,number,value,datetime_start,datetime_complete,duration,params_activation_fn,params_batch_size,params_clip_range,params_ent_coef,params_gae_lambda,params_gamma,params_learning_rate,params_max_grad_norm,params_n_epochs,params_n_steps,params_net_arch,params_vf_coef,state
0,0,-560.0,2021-12-13 03:14:23.978250,2021-12-13 03:19:50.729780,0 days 00:05:26.751530,tanh,64,0.1,0.0009218360920407727,0.8,0.9999,0.0057450352950237284,0.8,10,64,medium,0.3179771348290872,COMPLETE
1,1,-1658.0,2021-12-13 03:19:50.748309,2021-12-13 03:24:01.334323,0 days 00:04:10.586014,tanh,64,0.4,0.001793295778099675,0.99,0.995,0.3174141059953945,0.7,20,1024,small,0.7428434786210398,COMPLETE
2,2,-1154.0,2021-12-13 03:24:01.350646,2021-12-13 03:26:04.349959,0 days 00:02:02.999313,relu,16,0.1,5.738017904789208e-08,0.98,0.95,0.00015246414802926134,0.6,1,64,medium,0.2758176257301139,COMPLETE
3,3,20.0,2021-12-13 03:26:04.366854,2021-12-13 03:31:58.500208,0 days 00:05:54.133354,tanh,512,0.4,3.904412199057682e-07,1.0,0.95,0.05449330051856364,0.6,20,32,small,0.8979475600547089,COMPLETE
4,4,-568.0,2021-12-13 03:31:58.515318,2021-12-13 03:34:58.065737,0 days 00:02:59.550419,relu,256,0.2,0.0045010554519793015,0.95,0.9,0.0006450692068726258,0.8,20,2048,small,0.030439254775223357,COMPLETE
5,5,-1120.0,2021-12-13 03:34:58.080691,2021-12-13 03:54:57.634866,0 days 00:19:59.554175,relu,8,0.2,1.197789882367384e-06,0.95,0.95,0.047897803664946184,0.5,10,256,medium,0.45281577275992047,COMPLETE
6,6,-98664.0,2021-12-13 03:54:57.650889,2021-12-13 03:56:19.893587,0 days 00:01:22.242698,relu,512,0.4,0.009795613490290853,0.92,0.99,2.9263514242996006e-05,0.8,1,128,medium,0.9733412789254869,COMPLETE
7,7,-250000.0,2021-12-13 03:56:19.909136,2021-12-13 03:58:05.247923,0 days 00:01:45.338787,relu,256,0.1,1.4754869283396115e-07,0.9,0.9,0.28968100249683365,0.7,1,16,small,0.004064908308376913,COMPLETE
8,8,-250000.0,2021-12-13 03:58:05.266616,2021-12-13 04:04:17.815004,0 days 00:06:12.548388,tanh,64,0.3,6.901950810174502e-05,0.9,0.98,0.434518525679161,0.5,10,256,medium,0.7065937586058795,COMPLETE
9,9,-250000.0,2021-12-13 04:04:17.829984,2021-12-13 04:26:30.141218,0 days 00:22:12.311234,relu,8,0.2,0.00015792689312578025,0.99,0.95,0.004959231091967861,0.8,10,2048,medium,0.8956031163773185,COMPLETE
10,10,-206.0,2021-12-13 04:26:30.156139,2021-12-13 04:28:30.338413,0 days 00:02:00.182274,tanh,512,0.4,5.043456406986391e-06,1.0,0.999,0.028962500821441556,0.6,5,32,small,0.6890384800625298,COMPLETE
11,11,-356.0,2021-12-13 04:28:30.353413,2021-12-13 04:30:30.241077,0 days 00:01:59.887664,tanh,512,0.4,3.739337232828331e-06,1.0,0.999,0.029551547080320557,0.6,5,32,small,0.6961777711416907,COMPLETE
12,12,-250000.0,2021-12-13 04:30:30.256459,2021-12-13 04:31:15.771547,0 days 00:00:45.515088,tanh,512,0.4,1.0904208811660749e-08,1.0,0.999,0.04382497258276276,5.0,5,32,small,0.8070539578723677,PRUNED
13,13,-1150.0,2021-12-13 04:31:15.776837,2021-12-13 04:33:14.125514,0 days 00:01:58.348677,tanh,128,0.4,4.1822424513054345e-06,1.0,0.999,0.013211708397971799,0.6,5,32,small,0.5657366155648408,COMPLETE
14,14,500.0,2021-12-13 04:33:14.140669,2021-12-13 04:39:28.002748,0 days 00:06:13.862079,tanh,32,0.3,7.061959152230664e-07,1.0,0.98,0.0011914362051168525,0.3,20,512,small,0.5716771293542668,COMPLETE
15,15,-250000.0,2021-12-13 04:39:28.018148,2021-12-13 04:41:15.828088,0 days 00:01:47.809940,tanh,32,0.3,3.8570773936070076e-07,1.0,0.98,0.0009463163264864116,0.3,20,512,small,0.5204481825201521,PRUNED
16,16,-750.0,2021-12-13 04:41:15.833582,2021-12-13 04:47:17.008249,0 days 00:06:01.174667,tanh,32,0.3,2.152058520341154e-08,0.8,0.98,0.0009188398615103058,0.3,20,512,small,0.9833661718255562,COMPLETE
17,17,-1320.0,2021-12-13 04:47:17.023236,2021-12-13 05:05:32.571358,0 days 00:18:15.548122,tanh,32,0.3,0.050074725275213616,0.92,0.995,1.7053964050238908e-05,2.0,20,8,small,0.3817181325735167,COMPLETE
18,18,-250000.0,2021-12-13 05:05:32.586642,2021-12-13 05:08:20.384237,0 days 00:02:47.797595,tanh,16,0.3,2.355649617986216e-05,0.98,0.99,7.372341531896498e-05,0.9,20,512,small,0.1330186991105125,PRUNED
19,19,-784.0,2021-12-13 05:08:20.389800,2021-12-13 05:26:32.097907,0 days 00:18:11.708107,tanh,128,0.3,4.4069692295873063e-07,1.0,0.9999,0.00020944239421887185,1.0,20,8,small,0.598241727709645,COMPLETE
20,20,-1592.0,2021-12-13 05:26:32.113034,2021-12-13 05:32:39.094632,0 days 00:06:06.981598,tanh,32,0.4,1.2688654172617746e-07,1.0,0.95,0.08947070765374844,0.3,20,1024,small,0.8408195566230018,COMPLETE
21,21,-840.0,2021-12-13 05:32:39.109972,2021-12-13 05:34:42.488189,0 days 00:02:03.378217,tanh,512,0.4,6.33488563282625e-06,1.0,0.999,0.01192934245737489,0.6,5,32,small,0.6684463529052324,COMPLETE
22,22,-250000.0,2021-12-13 05:34:42.503367,2021-12-13 05:35:28.178549,0 days 00:00:45.675182,tanh,512,0.4,9.828525609163001e-07,1.0,0.98,0.0841219033258458,0.6,5,32,small,0.6206476555845496,PRUNED
23,23,-1328.0,2021-12-13 05:35:28.184062,2021-12-13 05:38:25.407149,0 days 00:02:57.223087,tanh,512,0.4,1.617294443706729e-05,1.0,0.95,0.017693207954504724,2.0,5,16,small,0.8137031242014056,COMPLETE
24,24,-368.0,2021-12-13 05:38:25.422311,2021-12-13 05:41:27.112013,0 days 00:03:01.689702,tanh,512,0.4,1.5256978967059588e-06,1.0,0.999,0.9908302424030648,5.0,20,128,small,0.9104120865931411,COMPLETE
25,25,-728.0,2021-12-13 05:41:27.126932,2021-12-13 05:43:09.864566,0 days 00:01:42.737634,tanh,32,0.3,9.690298267531876e-05,1.0,0.98,0.00219106736917725,1.0,20,512,small,0.4614394487793996,PRUNED
26,26,-332.0,2021-12-13 05:43:09.869957,2021-12-13 05:45:11.989380,0 days 00:02:02.119423,tanh,512,0.2,2.659512366463458e-07,0.9,0.99,0.0019572778039564677,0.9,5,32,small,0.734118494075418,COMPLETE
27,27,300.0,2021-12-13 05:45:12.004422,2021-12-13 05:46:10.372264,0 days 00:00:58.367842,tanh,128,0.1,4.996343827384391e-08,0.99,0.9999,0.11247208254235691,0.3,1,32,small,0.5199761497636759,COMPLETE
28,28,-250000.0,2021-12-13 05:46:10.387206,2021-12-13 05:46:33.274926,0 days 00:00:22.887720,tanh,128,0.1,5.357729625532212e-08,0.99,0.9999,0.14393405635972617,0.3,1,512,small,0.20980102804310324,PRUNED
29,29,-95882.0,2021-12-13 05:46:33.280549,2021-12-13 05:47:08.137114,0 days 00:00:34.856565,tanh,128,0.1,3.7179865585585454e-08,0.8,0.9999,0.0067322805894696825,0.3,1,64,medium,0.3586455872018829,PRUNED
30,30,-384.0,2021-12-13 05:47:08.142508,2021-12-13 05:48:05.253936,0 days 00:00:57.111428,tanh,128,0.1,0.0003497717835618659,0.99,0.9999,0.9426390054976355,0.3,1,32,small,0.5213389899356481,COMPLETE
31,31,-1592.0,2021-12-13 05:48:05.269004,2021-12-13 05:48:23.649687,0 days 00:00:18.380683,tanh,256,0.1,7.557132208332542e-06,0.99,0.9999,0.14643079517876642,0.6,1,32,small,0.638885455949987,PRUNED
32,32,264.0,2021-12-13 05:48:23.654598,2021-12-13 05:54:18.573697,0 days 00:05:54.919099,tanh,64,0.1,7.634122131624388e-07,0.99,0.995,0.005522915606765613,0.3,20,32,small,0.42477301863635597,COMPLETE
33,33,-250000.0,2021-12-13 05:54:18.588552,2021-12-13 05:55:29.650130,0 days 00:01:11.061578,tanh,64,0.1,1.3643218368978251e-07,0.99,0.995,0.0004797611291915173,0.3,20,1024,small,0.4044132166273423,PRUNED
34,34,-798.0,2021-12-13 05:55:29.655646,2021-12-13 06:01:21.409070,0 days 00:05:51.753424,tanh,64,0.1,5.824544294555235e-07,0.99,0.995,0.003882630229408464,0.3,20,32,small,0.28461742827186487,COMPLETE
35,35,-250000.0,2021-12-13 06:01:21.424485,2021-12-13 06:02:42.883962,0 days 00:01:21.459477,relu,64,0.1,1.1615524697766924e-08,0.95,0.995,0.008129689628267007,0.7,20,64,small,0.44968081935134674,PRUNED
36,36,-199520.0,2021-12-13 06:02:42.888966,2021-12-13 06:08:23.757995,0 days 00:05:40.869029,tanh,16,0.1,2.056708698436022e-06,0.98,0.9,0.00025791110725293287,0.3,20,2048,medium,0.5470961243595962,PRUNED
37,37,-250000.0,2021-12-13 06:08:23.763366,2021-12-13 06:11:19.287485,0 days 00:02:55.524119,relu,8,0.1,8.32801474973327e-08,0.99,0.95,0.001741201156823331,0.5,10,256,small,0.2344183266577629,PRUNED
38,38,-98.0,2021-12-13 06:11:19.293003,2021-12-13 06:12:41.014807,0 days 00:01:21.721804,tanh,64,0.2,2.907594092183725e-08,0.92,0.995,0.2627315355121914,0.3,1,128,medium,0.3477471382365474,COMPLETE
39,39,-1114.0,2021-12-13 06:12:41.030187,2021-12-13 06:22:22.936100,0 days 00:09:41.905913,relu,64,0.1,2.2050900745376448e-07,0.95,0.95,0.033426791982043784,0.7,20,16,small,0.46572226431245806,COMPLETE
40,40,-228.0,2021-12-13 06:22:22.951568,2021-12-13 06:29:52.538324,0 days 00:07:29.586756,tanh,256,0.3,8.027241367762964e-07,0.99,0.9,0.07997076197824227,0.8,10,32,medium,0.7621219133394611,COMPLETE
41,41,-1204.0,2021-12-13 06:29:52.553338,2021-12-13 06:31:14.271845,0 days 00:01:21.718507,tanh,64,0.2,2.2121707138040427e-08,0.92,0.995,0.2556269488188148,0.3,1,128,medium,0.34797167327429335,COMPLETE
42,42,-152.0,2021-12-13 06:31:14.286797,2021-12-13 06:32:37.988613,0 days 00:01:23.701816,tanh,64,0.2,4.539257867053701e-08,0.92,0.995,0.46757835733383074,0.3,1,128,medium,0.3040015625404838,COMPLETE
43,43,-680.0,2021-12-13 06:32:38.003874,2021-12-13 06:34:00.973498,0 days 00:01:22.969624,tanh,64,0.2,7.085219844918423e-08,0.92,0.995,0.18933663187414013,0.3,1,128,medium,0.42034720407963366,COMPLETE
44,44,-250000.0,2021-12-13 06:34:00.989000,2021-12-13 06:35:02.400844,0 days 00:01:01.411844,tanh,8,0.2,2.6971614356467262e-08,0.92,0.995,0.4719627691208777,5.0,1,128,medium,0.1384476124910087,PRUNED
45,45,-1192.0,2021-12-13 06:35:02.406504,2021-12-13 06:37:59.210071,0 days 00:02:56.803567,relu,128,0.2,2.6407250962221013e-07,0.9,0.98,0.05597493942993122,0.5,1,8,medium,0.4976855672792649,COMPLETE
46,46,-1544.0,2021-12-13 06:37:59.226753,2021-12-13 06:52:09.566312,0 days 00:14:10.339559,tanh,32,0.1,2.8728987354613016e-06,0.8,0.95,0.024521340556025138,0.3,20,256,medium,0.5755851191345738,COMPLETE
47,47,-250000.0,2021-12-13 06:52:09.582137,2021-12-13 06:52:33.986958,0 days 00:00:24.404821,tanh,64,0.2,1.0288918307387736e-07,0.98,0.9999,0.0005249534587924892,2.0,1,2048,small,0.34282755949256016,PRUNED
48,48,-1072.0,2021-12-13 06:52:33.992584,2021-12-13 06:57:45.580748,0 days 00:05:11.588164,tanh,16,0.3,0.0027713269765592048,0.99,0.98,0.3226863066591137,0.9,10,32,small,0.24111568428253055,COMPLETE
49,49,-672.0,2021-12-13 06:57:45.596488,2021-12-13 06:59:28.398963,0 days 00:01:42.802475,relu,32,0.3,1.5758615470991035e-08,0.92,0.99,0.011629116842393882,1.0,20,512,small,0.41311646270239055,PRUNED
50,50,-250000.0,2021-12-13 06:59:28.404653,2021-12-13 07:02:08.169354,0 days 00:02:39.764701,tanh,64,0.4,6.046532628964993e-07,0.99,0.995,0.0027301335368906583,0.8,20,1024,medium,0.9073735606483506,PRUNED
51,51,-158.0,2021-12-13 07:02:08.174878,2021-12-13 07:03:29.853812,0 days 00:01:21.678934,tanh,64,0.2,4.267246372691885e-08,0.92,0.995,0.451581915336899,0.3,1,128,medium,0.1929837497281643,COMPLETE
52,52,-434.0,2021-12-13 07:03:29.868656,2021-12-13 07:04:53.532407,0 days 00:01:23.663751,tanh,64,0.2,4.8460348435080475e-08,0.92,0.995,0.6442943708239303,0.3,1,128,medium,0.2952050321754698,COMPLETE
53,53,-424.0,2021-12-13 07:04:53.547454,2021-12-13 07:06:14.826387,0 days 00:01:21.278933,tanh,64,0.2,2.374886049745759e-07,0.92,0.995,0.2036297356866455,0.3,1,128,medium,0.07567255187411465,COMPLETE
54,54,-1208.0,2021-12-13 07:06:14.842618,2021-12-13 07:06:43.074818,0 days 00:00:28.232200,tanh,128,0.2,1.4820547129117876e-07,0.92,0.995,0.12866055660387904,0.3,1,32,medium,0.33050776830552686,PRUNED
55,55,-250000.0,2021-12-13 07:06:43.080431,2021-12-13 07:07:07.368994,0 days 00:00:24.288563,tanh,256,0.2,2.7034925102080936e-08,0.95,0.9,0.0012102533966075555,0.6,1,128,small,0.3782651649539049,PRUNED
56,56,-250000.0,2021-12-13 07:07:07.374337,2021-12-13 07:10:04.222680,0 days 00:02:56.848343,tanh,64,0.4,1.0031481214525206e-05,1.0,0.98,0.06619457562185065,0.3,20,512,medium,0.29766169027512257,PRUNED
57,57,-328.0,2021-12-13 07:10:04.228342,2021-12-13 07:11:13.385602,0 days 00:01:09.157260,tanh,32,0.3,1.0096931859692998e-08,0.9,0.95,0.3277558668259628,0.3,1,16,small,0.48849572287280807,COMPLETE
58,58,-250000.0,2021-12-13 07:11:13.400830,2021-12-13 07:16:49.566613,0 days 00:05:36.165783,tanh,8,0.1,9.756281961289828e-07,1.0,0.995,0.00010352964799576226,0.6,20,32,small,0.5360885621927723,PRUNED
59,59,-250000.0,2021-12-13 07:16:49.572384,2021-12-13 07:20:56.071256,0 days 00:04:06.498872,tanh,512,0.4,1.7756924997246867e-06,0.8,0.9999,0.6736748507841855,0.7,20,64,small,0.4385697928413387,COMPLETE
60,60,-804.0,2021-12-13 07:20:56.086377,2021-12-13 07:40:41.032869,0 days 00:19:44.946492,tanh,16,0.2,4.563425661874147e-07,0.92,0.99,0.040647754758567176,5.0,10,8,medium,0.9551062585280217,COMPLETE
61,61,-250000.0,2021-12-13 07:40:41.048154,2021-12-13 07:41:16.867811,0 days 00:00:35.819657,tanh,64,0.2,4.2694416376211555e-08,0.92,0.995,0.5686868984319978,0.3,1,128,medium,0.13755834098081315,PRUNED
62,62,-132.0,2021-12-13 07:41:16.873310,2021-12-13 07:42:39.452830,0 days 00:01:22.579520,tanh,64,0.2,6.503076889159808e-08,0.92,0.995,0.3670210212383205,0.3,1,128,medium,0.18672550328759632,COMPLETE
63,63,-808.0,2021-12-13 07:42:39.468167,2021-12-13 07:43:03.632921,0 days 00:00:24.164754,tanh,64,0.2,8.889457878056662e-08,0.92,0.995,0.299131726899506,0.3,1,128,medium,0.17761501794271345,PRUNED
64,64,-250000.0,2021-12-13 07:43:03.639047,2021-12-13 07:44:57.758894,0 days 00:01:54.119847,tanh,64,0.2,1.5226199898084195e-07,1.0,0.995,0.121577626536614,0.3,1,128,medium,0.08180119005430186,COMPLETE
65,65,-744.0,2021-12-13 07:44:57.773113,2021-12-13 07:45:55.091019,0 days 00:00:57.317906,tanh,128,0.3,4.2556426631569696e-05,0.92,0.98,0.1948386125944624,2.0,1,32,small,0.31197688558922054,COMPLETE
66,66,-250000.0,2021-12-13 07:45:55.106761,2021-12-13 07:46:27.465247,0 days 00:00:32.358486,tanh,512,0.1,6.89378403907902e-08,0.98,0.999,0.10375938315859716,0.3,1,512,medium,0.2455671473024826,PRUNED
67,67,-250000.0,2021-12-13 07:46:27.470890,2021-12-13 07:48:23.165764,0 days 00:01:55.694874,tanh,32,0.4,3.462896187024403e-07,0.99,0.95,0.020524727902739088,1.0,20,32,small,0.8645193144939134,PRUNED
68,68,-250000.0,2021-12-13 07:48:23.171221,2021-12-13 07:48:57.429818,0 days 00:00:34.258597,tanh,64,0.2,2.5616007865033527e-08,1.0,0.9999,0.890325733525294,0.6,5,2048,small,0.38576612876965827,PRUNED
69,69,-1264.0,2021-12-13 07:48:57.435159,2021-12-13 07:55:51.366282,0 days 00:06:53.931123,relu,512,0.1,1.63496866387765e-07,0.99,0.995,0.004718561772108436,0.9,20,256,medium,0.25838304088571584,COMPLETE
70,70,-47248.0,2021-12-13 07:55:51.381816,2021-12-13 07:56:06.780739,0 days 00:00:15.398923,tanh,128,0.3,0.05724855603665638,0.92,0.995,0.0012785210149884973,0.5,1,128,small,0.6282800743687296,PRUNED
71,71,-232.0,2021-12-13 07:56:06.786524,2021-12-13 07:57:28.137955,0 days 00:01:21.351431,tanh,64,0.2,4.081815884025347e-08,0.92,0.995,0.4130643089086941,0.3,1,128,medium,0.2014213961210904,COMPLETE
72,72,-326.0,2021-12-13 07:57:28.153526,2021-12-13 07:58:49.783010,0 days 00:01:21.629484,tanh,64,0.2,1.6176434288541666e-08,0.92,0.995,0.39887513054147333,0.3,1,128,medium,0.1831773644738995,COMPLETE
73,73,-1136.0,2021-12-13 07:58:49.798340,2021-12-13 08:00:10.848312,0 days 00:01:21.049972,tanh,64,0.2,0.0006726644742960741,0.92,0.995,0.19293903821701733,0.3,1,128,medium,0.09775640424797385,COMPLETE
74,74,-249796.0,2021-12-13 08:00:10.863595,2021-12-13 08:00:44.885888,0 days 00:00:34.022293,tanh,64,0.2,5.787783865924045e-08,1.0,0.995,0.00030880237230224855,0.3,1,1024,medium,0.27475248149596165,PRUNED
75,75,-278.0,2021-12-13 08:00:44.891082,2021-12-13 08:02:19.880539,0 days 00:01:34.989457,tanh,64,0.2,8.885508291185061e-08,0.92,0.98,0.24827736950828763,0.3,1,32,medium,0.16227498712506164,COMPLETE
76,76,12.0,2021-12-13 08:02:19.897765,2021-12-13 08:05:22.893712,0 days 00:03:02.995947,tanh,256,0.1,0.024142066433172925,0.95,0.95,0.5076258606400816,0.3,20,128,small,0.2179949709876477,COMPLETE
77,77,-250000.0,2021-12-13 08:05:22.910409,2021-12-13 08:06:15.987858,0 days 00:00:53.077449,tanh,256,0.1,0.015443181902381793,0.95,0.95,0.766961683901758,0.8,20,512,small,0.03470068826310374,PRUNED
78,78,-250000.0,2021-12-13 08:06:15.993324,2021-12-13 08:07:38.271335,0 days 00:01:22.278011,tanh,256,0.1,0.012496095677740795,0.95,0.95,4.529312030425886e-05,0.3,20,64,small,0.5776745067139497,PRUNED
79,79,-320.0,2021-12-13 08:07:38.277022,2021-12-13 08:17:21.680637,0 days 00:09:43.403615,relu,256,0.1,0.00016589902710463305,0.95,0.95,0.08500698276894639,0.6,20,16,small,0.4793109969355418,COMPLETE
80,80,-250000.0,2021-12-13 08:17:21.696126,2021-12-13 08:19:17.420658,0 days 00:01:55.724532,tanh,256,0.1,2.8035485093021773e-06,0.95,0.95,0.5374677167217592,0.3,20,32,small,0.6668456536010586,PRUNED
81,81,-404.0,2021-12-13 08:19:17.426368,2021-12-13 08:25:10.277206,0 days 00:05:52.850838,tanh,32,0.1,3.397827076675854e-08,0.99,0.9999,0.4674880678144534,0.3,20,128,small,0.2197244312848502,COMPLETE
82,82,-1008.0,2021-12-13 08:25:10.292685,2021-12-13 08:26:40.341801,0 days 00:01:30.049116,tanh,64,0.4,1.7443304962419812e-08,0.9,0.9,0.2522225159605939,0.3,5,128,small,0.3672414934712312,COMPLETE
83,83,-250000.0,2021-12-13 08:26:40.357409,2021-12-13 08:27:42.048554,0 days 00:01:01.691145,tanh,8,0.2,0.03508675841832373,0.8,0.995,0.37490884940092206,0.3,1,128,medium,0.2669421468340932,PRUNED
84,84,-250000.0,2021-12-13 08:27:42.054154,2021-12-13 08:28:25.535741,0 days 00:00:43.481587,tanh,512,0.1,1.214696075062211e-06,1.0,0.999,0.066998083340887,0.3,10,128,small,0.3179669651975154,PRUNED
85,85,-250000.0,2021-12-13 08:28:25.541303,2021-12-13 08:30:58.153674,0 days 00:02:32.612371,tanh,128,0.3,7.127966106370083e-07,0.92,0.95,0.16121553512609174,0.3,20,128,medium,0.10733357968275677,PRUNED
86,86,-1370.0,2021-12-13 08:30:58.159372,2021-12-13 08:32:34.313950,0 days 00:01:36.154578,tanh,64,0.2,3.5545538510677557e-07,0.99,0.99,0.008253666641200107,5.0,1,8,small,0.42972991666729166,COMPLETE
87,87,-250000.0,2021-12-13 08:32:34.329473,2021-12-13 08:39:24.659803,0 days 00:06:50.330330,tanh,16,0.4,0.005157617381399419,0.98,0.995,0.615152987591035,0.7,20,32,medium,0.16009082730077587,PRUNED
88,88,-250000.0,2021-12-13 08:39:24.665587,2021-12-13 08:39:51.571233,0 days 00:00:26.905646,tanh,32,0.1,0.09233999942517483,0.92,0.98,0.0006924748478681452,0.3,1,128,small,0.5041034042541978,PRUNED
89,89,-250000.0,2021-12-13 08:39:51.576939,2021-12-13 08:42:48.364272,0 days 00:02:56.787333,tanh,64,0.2,1.2263945970381668e-07,1.0,0.9999,0.11373848899379353,2.0,20,512,medium,0.21013225435504318,PRUNED
90,90,-250000.0,2021-12-13 08:42:48.369841,2021-12-13 08:43:11.805542,0 days 00:00:23.435701,tanh,256,0.3,2.393194883737478e-07,0.95,0.995,0.2212836646257564,0.9,1,2048,small,0.3466751794688786,PRUNED
91,91,-836.0,2021-12-13 08:43:11.811318,2021-12-13 08:45:12.195734,0 days 00:02:00.384416,tanh,512,0.4,2.447192503411772e-05,1.0,0.999,0.043723975627865855,0.6,5,32,small,0.8083796057362057,COMPLETE
92,92,-904.0,2021-12-13 08:45:12.211092,2021-12-13 08:47:12.285243,0 days 00:02:00.074151,tanh,512,0.1,1.411019573077444e-06,1.0,0.95,0.01471127407929386,0.6,5,32,small,0.606759161620801,COMPLETE
93,93,-774.0,2021-12-13 08:47:12.300815,2021-12-13 08:49:19.866571,0 days 00:02:07.565756,tanh,512,0.4,5.104931451721937e-07,1.0,0.999,0.15671604349669335,0.6,5,32,small,0.6988985560936132,COMPLETE
94,94,-404.0,2021-12-13 08:49:19.889410,2021-12-13 08:51:23.248537,0 days 00:02:03.359127,tanh,512,0.4,6.345171694150686e-06,0.99,0.999,0.03494438764307963,1.0,5,32,small,0.7746362590033774,COMPLETE
95,95,-149598.0,2021-12-13 08:51:23.264332,2021-12-13 08:52:39.701556,0 days 00:01:16.437224,tanh,64,0.4,2.5651032396672386e-06,0.92,0.999,1.1227338476091076e-05,0.6,20,256,small,0.658270284608183,PRUNED
96,96,-1070.0,2021-12-13 08:52:39.707078,2021-12-13 08:53:27.479836,0 days 00:00:47.772758,relu,128,0.4,1.958461608397116e-07,1.0,0.995,0.05941922589063418,0.3,5,128,medium,0.7334588420436585,PRUNED
97,97,-482.0,2021-12-13 08:53:27.485486,2021-12-13 08:54:26.817870,0 days 00:00:59.332384,tanh,64,0.2,6.020857637291708e-08,0.9,0.98,0.0028934496047779675,0.5,1,32,small,0.4018673169501135,COMPLETE
98,98,-247754.0,2021-12-13 08:54:26.834026,2021-12-13 08:55:25.465812,0 days 00:00:58.631786,tanh,32,0.2,3.260731759444255e-08,0.99,0.995,0.025911820831193286,0.8,10,1024,small,0.9455844689475816,PRUNED
99,99,-250000.0,2021-12-13 08:55:25.471795,2021-12-13 08:57:59.897315,0 days 00:02:34.425520,tanh,512,0.1,1.3468548775448915e-08,0.92,0.9,0.2841326540116624,0.3,20,128,medium,0.557650202511196,PRUNED
100,100,-250000.0,2021-12-13 08:57:59.903209,2021-12-13 08:59:14.977769,0 days 00:01:15.074560,tanh,64,0.3,5.065782555659004e-06,0.8,0.9999,0.09896841801408987,0.3,1,512,small,0.9950663818968889,COMPLETE
101,101,-212.0,2021-12-13 08:59:14.993739,2021-12-13 09:06:45.632260,0 days 00:07:30.638521,tanh,256,0.3,9.267139514616673e-07,0.99,0.9,0.9916848178971285,0.8,10,32,medium,0.7741275918895617,COMPLETE
102,102,-250000.0,2021-12-13 09:06:45.648598,2021-12-13 09:09:12.034062,0 days 00:02:26.385464,tanh,256,0.3,9.28958490315636e-06,0.99,0.9,0.857675860437808,0.8,10,32,medium,0.8631320262258617,PRUNED
103,103,-250000.0,2021-12-13 09:09:12.039655,2021-12-13 09:11:38.336320,0 days 00:02:26.296665,tanh,256,0.3,9.689009008852765e-07,0.99,0.995,0.7297110135464183,0.8,10,32,medium,0.78625007255074,PRUNED
104,104,-250000.0,2021-12-13 09:11:38.342061,2021-12-13 09:14:06.250320,0 days 00:02:27.908259,tanh,256,0.3,3.588784005996399e-06,0.99,0.9,0.494341024978401,0.8,10,32,medium,0.827100917357982,PRUNED
105,105,-250000.0,2021-12-13 09:14:06.256020,2021-12-13 09:20:20.431028,0 days 00:06:14.175008,tanh,8,0.3,1.621078933568171e-05,1.0,0.9,0.9666140704553711,0.6,10,16,medium,0.7458337308058354,PRUNED
106,106,-940.0,2021-12-13 09:20:20.436535,2021-12-13 09:21:50.203776,0 days 00:01:29.767241,tanh,256,0.2,3.175306284590208e-07,0.92,0.99,0.3867274655424076,0.3,1,64,medium,0.5323904684523613,COMPLETE
