,number,value,datetime_start,datetime_complete,duration,params_activation_fn,params_batch_size,params_clip_range,params_ent_coef,params_gae_lambda,params_gamma,params_learning_rate,params_max_grad_norm,params_n_epochs,params_n_steps,params_net_arch,params_vf_coef,state
428,428,-1084.0,2021-12-14 07:32:41.928961,2021-12-14 07:43:03.660722,0 days 00:10:21.731761,tanh,8,0.2,1.0525836871516123e-05,0.98,0.95,0.000950645629651397,0.3,5,16,medium,0.24513706609532854,COMPLETE
429,429,-656.0,2021-12-14 07:43:03.677118,2021-12-14 08:01:21.579046,0 days 00:18:17.901928,tanh,8,0.2,8.245687517247627e-07,0.98,0.95,0.0007919320396652668,0.6,20,16,small,0.5919797089028447,COMPLETE
430,430,-388.0,2021-12-14 08:01:21.596265,2021-12-14 08:39:53.121468,0 days 00:38:31.525203,tanh,8,0.2,2.459584824560572e-07,0.95,0.95,0.0006335224951584859,0.3,20,32,medium,0.19528186426972044,COMPLETE
431,431,-786.0,2021-12-14 08:39:53.138039,2021-12-14 08:49:43.020752,0 days 00:09:49.882713,relu,256,0.1,1.572111391142396e-05,1.0,0.98,0.13348759939033739,0.3,20,16,small,0.22007327049548647,COMPLETE
432,432,-688.0,2021-12-14 08:49:43.037698,2021-12-14 09:00:15.357145,0 days 00:10:32.319447,tanh,8,0.2,6.205167310703477e-07,0.95,0.9999,0.0004926771292842153,0.3,5,16,medium,0.1733723941879306,COMPLETE
433,433,-684.0,2021-12-14 09:00:15.373620,2021-12-14 09:03:22.190577,0 days 00:03:06.816957,tanh,128,0.4,3.599866871677302e-07,0.98,0.95,0.0008650345544285067,0.8,20,256,small,0.25827553491198113,COMPLETE
434,434,-760.0,2021-12-14 09:03:22.207165,2021-12-14 09:42:59.197213,0 days 00:39:36.990048,tanh,8,0.2,1.5218263487015462e-07,1.0,0.999,0.0954117889639205,0.3,20,512,medium,0.5124154500411389,COMPLETE
435,435,-476.0,2021-12-14 09:42:59.213931,2021-12-14 09:43:59.700171,0 days 00:01:00.486240,tanh,128,0.1,8.584844069180562e-07,0.95,0.95,0.00153266278689006,0.3,1,32,small,0.8476794043226352,COMPLETE
436,436,-1512.0,2021-12-14 09:43:59.716790,2021-12-14 09:44:37.702062,0 days 00:00:37.985272,tanh,32,0.4,4.899750448667842e-07,1.0,0.95,0.0021014323223296815,0.6,5,2048,small,0.14005393370483876,PRUNED
437,437,-250000.0,2021-12-14 09:44:37.708529,2021-12-14 09:49:02.250311,0 days 00:04:24.541782,tanh,256,0.2,2.9132806538338846e-06,0.92,0.9999,0.07775685077978367,0.3,20,32,medium,0.20161756462240413,PRUNED
438,438,-1138.0,2021-12-14 09:49:02.256882,2021-12-14 09:49:50.182286,0 days 00:00:47.925404,tanh,128,0.2,2.480672211410134e-07,0.92,0.95,0.0013518129744617552,5.0,1,1024,small,0.29990424715294756,COMPLETE
439,439,-250000.0,2021-12-14 09:49:50.199537,2021-12-14 09:54:08.272388,0 days 00:04:18.072851,tanh,32,0.4,1.281805545439842e-06,0.9,0.95,0.15148640795259435,0.5,20,256,medium,0.8634818489489007,PRUNED
440,440,-248960.0,2021-12-14 09:54:08.278974,2021-12-14 09:55:29.809752,0 days 00:01:21.530778,tanh,128,0.1,3.861544455000586e-07,0.95,0.999,0.00031783321635855,0.3,20,64,small,0.22476227968471663,PRUNED
441,441,-160.0,2021-12-14 09:55:29.816256,2021-12-14 09:57:06.957134,0 days 00:01:37.140878,tanh,32,0.2,1.1256165142872251e-07,1.0,0.9999,0.1135168105726281,0.7,1,32,medium,0.8919966655075879,COMPLETE
442,442,-1252.0,2021-12-14 09:57:06.974965,2021-12-14 10:02:14.713746,0 days 00:05:07.738781,tanh,8,0.2,6.704577104697567e-07,0.92,0.95,0.0763069303099462,0.8,5,16,small,0.569412130848961,COMPLETE
443,443,-250000.0,2021-12-14 10:02:14.732999,2021-12-14 10:06:43.616626,0 days 00:04:28.883627,relu,256,0.4,8.943949156859425e-07,0.92,0.98,0.00019496981789565558,0.3,20,32,medium,0.15682759425569692,PRUNED
444,444,-1532.0,2021-12-14 10:06:43.624093,2021-12-14 10:07:47.127568,0 days 00:01:03.503475,tanh,128,0.1,1.3663690294706259e-08,0.95,0.95,0.06367290897543926,0.3,1,256,small,0.18446887379349008,COMPLETE
445,445,-249376.0,2021-12-14 10:07:47.145591,2021-12-14 10:12:16.046074,0 days 00:04:28.900483,tanh,32,0.2,3.394994961254838e-07,1.0,0.95,0.0002670647321890548,0.3,20,32,medium,0.247708475742642,PRUNED
446,446,120.0,2021-12-14 10:12:16.052551,2021-12-14 10:13:24.798019,0 days 00:01:08.745468,tanh,16,0.2,1.5899986968377265e-07,0.8,0.9,0.185292439636645,2.0,1,32,small,0.5305242153571342,COMPLETE
447,447,-250000.0,2021-12-14 10:13:24.814747,2021-12-14 10:13:55.584496,0 days 00:00:30.769749,tanh,16,0.2,8.247171655721799e-08,0.8,0.9,0.16495678818050066,2.0,1,32,small,0.5255862404943824,PRUNED
448,448,-250000.0,2021-12-14 10:13:55.612802,2021-12-14 10:14:42.220985,0 days 00:00:46.608183,tanh,16,0.2,1.5321400340231786e-07,0.8,0.9,0.2071991363354612,2.0,1,256,medium,0.5350416790735522,PRUNED
449,449,-280.0,2021-12-14 10:14:42.227372,2021-12-14 10:15:55.741321,0 days 00:01:13.513949,tanh,16,0.2,1.8326754799666502e-07,0.8,0.9,0.18590256214121548,2.0,1,512,small,0.5022511266743404,COMPLETE
450,450,-848.0,2021-12-14 10:15:55.758188,2021-12-14 10:18:51.253564,0 days 00:02:55.495376,tanh,16,0.2,1.2104194655681944e-07,0.8,0.9,0.1351607446820645,2.0,1,8,medium,0.5521315677514864,COMPLETE
451,451,-1174.0,2021-12-14 10:18:51.270338,2021-12-14 10:19:48.147021,0 days 00:00:56.876683,tanh,64,0.2,1.939915767150175e-07,0.92,0.9,0.23707391380964463,2.0,1,32,small,0.4834600748654366,COMPLETE
452,452,-1048.0,2021-12-14 10:19:48.163544,2021-12-14 10:21:01.356941,0 days 00:01:13.193397,tanh,16,0.2,5.9316874240801634e-08,0.92,0.9,0.1086520810179356,2.0,1,2048,small,0.5143067463045917,COMPLETE
453,453,-300.0,2021-12-14 10:21:01.373796,2021-12-14 10:23:02.957525,0 days 00:02:01.583729,tanh,16,0.2,9.89134965379809e-08,0.8,0.9,0.15805881015247475,2.0,1,32,medium,0.5495955761175556,COMPLETE
454,454,-1026.0,2021-12-14 10:23:02.975146,2021-12-14 10:24:12.684624,0 days 00:01:09.709478,tanh,16,0.2,1.6263936431831146e-08,0.8,0.9999,0.6471147754770574,0.3,1,16,small,0.5353365176385676,COMPLETE
455,455,-1456.0,2021-12-14 10:24:12.701162,2021-12-14 10:34:03.717946,0 days 00:09:51.016784,relu,128,0.2,2.4720770716535687e-07,0.8,0.95,0.26060223353854856,0.3,20,64,medium,0.8763806264920062,COMPLETE
456,456,-184.0,2021-12-14 10:34:03.734852,2021-12-14 10:35:03.177851,0 days 00:00:59.442999,tanh,32,0.1,1.086532966045368e-08,0.8,0.95,0.1990316889076463,0.8,1,256,small,0.9030375921857207,COMPLETE
457,457,-792.0,2021-12-14 10:35:03.194423,2021-12-14 10:49:08.022884,0 days 00:14:04.828461,tanh,64,0.2,1.9240593200988057e-06,0.99,0.9,0.12325825765213988,0.3,20,32,medium,0.44081573699395976,COMPLETE
458,458,-1168.0,2021-12-14 10:49:08.039481,2021-12-14 10:50:41.684875,0 days 00:01:33.645394,tanh,8,0.2,1.445408881440645e-07,0.98,0.99,0.10082185415183968,1.0,1,32,small,0.2795484784245022,COMPLETE
459,459,-250000.0,2021-12-14 10:50:41.701550,2021-12-14 10:52:53.438059,0 days 00:02:11.736509,tanh,256,0.1,8.705579171089979e-08,0.95,0.95,0.1611431800476819,0.9,20,256,medium,0.10431813550934879,PRUNED
460,460,-808.0,2021-12-14 10:52:53.444746,2021-12-14 10:54:01.362128,0 days 00:01:07.917382,tanh,16,0.2,5.977445603915458e-08,0.92,0.9999,0.2720927378820257,0.3,1,32,small,0.5785749786446827,COMPLETE
461,461,-250000.0,2021-12-14 10:54:01.378966,2021-12-14 10:54:58.530826,0 days 00:00:57.151860,tanh,128,0.2,3.9510579567162724e-08,0.99,0.95,0.000539384494572049,0.3,20,1024,small,0.9165579375876615,PRUNED
462,462,-344.0,2021-12-14 10:54:58.537171,2021-12-14 11:02:29.101700,0 days 00:07:30.564529,tanh,32,0.1,2.5730308232966063e-07,0.92,0.95,0.007322607769881928,0.3,10,32,medium,0.23042099760146373,COMPLETE
463,463,-1264.0,2021-12-14 11:02:29.120516,2021-12-14 11:03:38.797488,0 days 00:01:09.676972,tanh,64,0.2,2.259824753698617e-08,0.92,0.98,0.0009802854154211138,2.0,1,16,small,0.5085725932085114,COMPLETE
464,464,-250000.0,2021-12-14 11:03:38.813662,2021-12-14 11:06:08.142912,0 days 00:02:29.329250,tanh,128,0.2,1.630708119708325e-07,0.95,0.9999,0.0924373447393,0.3,20,256,medium,0.4908813959043057,PRUNED
465,465,-250000.0,2021-12-14 11:06:08.149528,2021-12-14 11:08:04.249591,0 days 00:01:56.100063,tanh,32,0.1,5.699823636734113e-07,0.99,0.95,0.31529907870432805,0.8,20,32,small,0.5592359360001286,PRUNED
466,466,-816.0,2021-12-14 11:08:04.256287,2021-12-14 11:09:26.381024,0 days 00:01:22.124737,relu,64,0.2,1.4609958514154868e-08,0.92,0.95,0.20060362232842593,0.5,1,512,medium,0.25883601536236106,COMPLETE
467,467,-250000.0,2021-12-14 11:09:26.397930,2021-12-14 11:14:07.411273,0 days 00:04:41.013343,tanh,8,0.2,1.2408205124536242e-06,0.99,0.9,0.14131278228210228,0.3,20,2048,small,0.8406636771802073,PRUNED
468,468,-250000.0,2021-12-14 11:14:07.417560,2021-12-14 11:16:34.409685,0 days 00:02:26.992125,tanh,256,0.2,3.0688924260443966e-07,0.92,0.95,0.12635317625153986,0.3,10,32,medium,0.4671586586471726,PRUNED
469,469,-250000.0,2021-12-14 11:16:34.418379,2021-12-14 11:17:04.040840,0 days 00:00:29.622461,tanh,128,0.1,3.3094814767043695e-08,0.95,0.9999,0.0007159463333556146,0.3,1,64,small,0.08088896786608607,PRUNED
470,470,-250000.0,2021-12-14 11:17:04.048949,2021-12-14 11:18:35.981784,0 days 00:01:31.932835,tanh,64,0.2,8.477439308270104e-07,0.98,0.95,0.4609355496618931,0.3,20,256,small,0.9268685109309056,PRUNED
471,471,-1384.0,2021-12-14 11:18:35.990374,2021-12-14 11:20:26.828788,0 days 00:01:50.838414,tanh,32,0.2,9.06525668914211e-08,0.9,0.95,0.22773088749307213,0.8,1,32,medium,0.8819002799057937,COMPLETE
472,472,-968.0,2021-12-14 11:20:26.850625,2021-12-14 11:26:52.491643,0 days 00:06:25.641018,tanh,128,0.1,4.4873498279181713e-07,0.8,0.95,0.08667388152159464,0.3,20,32,small,0.30003542605243294,COMPLETE
473,473,-80.0,2021-12-14 11:26:52.511165,2021-12-14 11:39:24.819910,0 days 00:12:32.308745,tanh,64,0.2,4.7963801017452066e-08,0.92,0.9999,0.05443719458846259,0.3,10,16,medium,0.1285413827744219,COMPLETE
474,474,-250000.0,2021-12-14 11:39:24.839571,2021-12-14 11:39:54.927646,0 days 00:00:30.088075,tanh,32,0.2,5.879459199619888e-06,0.99,0.95,0.003756277463039328,0.3,1,256,small,0.6874173304142828,PRUNED
475,475,-1036.0,2021-12-14 11:39:54.935886,2021-12-14 12:22:32.741501,0 days 00:42:37.805615,tanh,8,0.1,1.3190968094564293e-07,0.92,0.98,0.17423505663719807,5.0,20,32,medium,0.64737797999515,COMPLETE
476,476,-250000.0,2021-12-14 12:22:32.761690,2021-12-14 12:33:45.792393,0 days 00:11:13.030703,tanh,16,0.2,2.325500682831262e-07,0.95,0.9,0.35039538887597393,0.7,20,32,small,0.20545463814727388,COMPLETE
477,477,-250000.0,2021-12-14 12:33:45.813347,2021-12-14 12:34:23.535738,0 days 00:00:37.722391,tanh,256,0.2,0.0024298652499666435,0.99,0.95,0.07974420878480143,0.5,1,512,medium,0.612794395633086,PRUNED
478,478,-980.0,2021-12-14 12:34:23.544245,2021-12-14 12:40:56.254451,0 days 00:06:32.710206,relu,64,0.1,1.7455363742056534e-08,0.92,0.95,0.10571637616312472,0.3,20,32,small,0.5270865313474066,COMPLETE
479,479,-1200.0,2021-12-14 12:40:56.274505,2021-12-14 12:42:47.269964,0 days 00:01:50.995459,tanh,128,0.4,1.0043367555293906e-08,0.92,0.9999,0.5663922431179531,0.3,1,8,small,0.8696774768353069,COMPLETE
480,480,-250000.0,2021-12-14 12:42:47.293744,2021-12-14 12:45:12.308196,0 days 00:02:25.014452,tanh,32,0.2,1.5512635209028091e-06,0.99,0.95,0.0011326180830100899,0.3,10,256,medium,0.250868355922693,PRUNED
481,481,-250000.0,2021-12-14 12:45:12.314821,2021-12-14 12:46:23.614496,0 days 00:01:11.299675,tanh,64,0.2,5.88464807455084e-07,0.95,0.99,0.0003944969802106012,0.8,20,2048,small,0.2134676550314754,PRUNED
482,482,-1658.0,2021-12-14 12:46:23.621058,2021-12-14 12:47:59.140087,0 days 00:01:35.519029,tanh,128,0.4,7.195576548307487e-08,0.92,0.95,0.0636939089117751,2.0,1,32,medium,0.9385260933055716,COMPLETE
483,483,-250000.0,2021-12-14 12:47:59.155224,2021-12-14 12:54:24.566754,0 days 00:06:25.411530,tanh,32,0.2,2.2688383824757083e-08,0.99,0.9999,0.1453006339074501,0.3,20,64,small,0.2345437907009399,COMPLETE
484,484,-250000.0,2021-12-14 12:54:24.583390,2021-12-14 12:57:34.583326,0 days 00:03:09.999936,tanh,8,0.1,2.990331148217059e-07,0.98,0.95,4.8344616897546857e-05,1.0,1,16,medium,0.2838462272086504,COMPLETE
485,485,-252.0,2021-12-14 12:57:34.600004,2021-12-14 13:03:28.611099,0 days 00:05:54.011095,tanh,64,0.2,9.116713586010274e-07,0.92,0.9,0.0016112543388104726,0.3,20,32,small,0.8976043446956278,COMPLETE
486,486,-250000.0,2021-12-14 13:03:28.627698,2021-12-14 13:04:48.735244,0 days 00:01:20.107546,tanh,256,0.2,0.015650591567433578,0.8,0.95,0.2016072065380033,0.3,10,256,medium,0.4181642178616418,PRUNED
487,487,-196.0,2021-12-14 13:04:48.742300,2021-12-14 13:05:47.567983,0 days 00:00:58.825683,tanh,128,0.4,1.7382370819650427e-07,0.95,0.98,0.2836271555537883,0.9,1,32,small,0.5379987246059439,COMPLETE
488,488,-64.0,2021-12-14 13:05:47.585018,2021-12-14 13:11:48.590924,0 days 00:06:01.005906,tanh,32,0.1,4.5782686549205964e-05,0.92,0.95,0.0724769192849612,0.3,20,32,small,0.45388586201290565,COMPLETE
489,489,-184.0,2021-12-14 13:11:48.608557,2021-12-14 13:34:31.084749,0 days 00:22:42.476192,relu,16,0.2,0.006014923584328251,0.99,0.9999,0.11472393540239506,0.8,20,256,medium,0.15291436523308982,COMPLETE
490,490,-1040.0,2021-12-14 13:34:31.101570,2021-12-14 13:35:34.242740,0 days 00:01:03.141170,tanh,64,0.3,0.009090917065533105,0.92,0.95,0.1599655004337914,0.3,1,1024,small,0.5679656975150061,COMPLETE
491,491,-384.0,2021-12-14 13:35:34.259914,2021-12-14 13:49:39.062308,0 days 00:14:04.802394,tanh,128,0.2,2.830566278230373e-08,0.95,0.95,0.0008052533928421853,0.3,20,32,medium,0.1972025980074233,COMPLETE
492,492,-1390.0,2021-12-14 13:49:39.078656,2021-12-14 13:50:35.751326,0 days 00:00:56.672670,tanh,32,0.4,4.372594407823108e-07,0.92,0.9,0.05416271801410038,0.5,1,32,small,0.4998958726588199,COMPLETE
493,493,-250000.0,2021-12-14 13:50:35.768032,2021-12-14 13:56:42.040225,0 days 00:06:06.272193,tanh,8,0.1,0.04272222334286754,0.99,0.95,0.2199063386106667,0.3,10,16,medium,0.22355416022772112,PRUNED
494,494,-116.0,2021-12-14 13:56:42.046750,2021-12-14 14:00:47.363163,0 days 00:04:05.316413,tanh,64,0.2,6.430791862559294e-07,0.92,0.995,0.0940006916899545,0.3,20,512,small,0.3315624475853645,COMPLETE
495,495,-448.0,2021-12-14 14:00:47.379932,2021-12-14 14:02:07.618133,0 days 00:01:20.238201,tanh,256,0.2,1.0499198588027358e-07,0.9,0.9999,0.00014495594917845293,0.8,1,256,medium,0.5925572215720547,COMPLETE
496,496,-1066.0,2021-12-14 14:02:07.635044,2021-12-14 14:08:01.612163,0 days 00:05:53.977119,tanh,512,0.4,4.3843897691483316e-08,0.99,0.95,0.04952413940989004,0.3,20,32,small,0.12363512600634828,COMPLETE
497,497,-250000.0,2021-12-14 14:08:01.628986,2021-12-14 14:08:25.563512,0 days 00:00:23.934526,tanh,128,0.1,2.1582459123470093e-07,0.92,0.95,0.0005239425414110037,2.0,1,2048,small,0.8589066673461904,PRUNED
498,498,-250000.0,2021-12-14 14:08:25.569956,2021-12-14 14:11:35.702969,0 days 00:03:10.133013,tanh,64,0.2,3.671941831724049e-07,0.95,0.98,0.7250784475339648,0.3,20,64,medium,0.7515302672096889,PRUNED
499,499,-250000.0,2021-12-14 14:11:35.709684,2021-12-14 14:12:45.176158,0 days 00:01:09.466474,tanh,32,0.3,1.7110306468563397e-08,0.8,0.995,0.3713892983540771,0.3,10,32,small,0.168686441146361,PRUNED
500,500,-250000.0,2021-12-14 14:12:45.182820,2021-12-14 14:13:19.444012,0 days 00:00:34.261192,relu,128,0.2,6.333616176085938e-08,0.98,0.95,0.11503232169598313,0.3,1,256,medium,0.9138802545836675,PRUNED
501,501,-250000.0,2021-12-14 14:13:19.450493,2021-12-14 14:15:15.950682,0 days 00:01:56.500189,tanh,512,0.4,7.9817511086399e-07,0.92,0.9999,0.06924165453858798,0.3,20,32,small,0.25348796641395854,PRUNED
502,502,-250000.0,2021-12-14 14:15:15.957479,2021-12-14 14:19:40.921172,0 days 00:04:24.963693,tanh,64,0.2,0.06746060550698714,0.99,0.95,0.1377185127444677,0.8,20,32,medium,0.8271147020366919,PRUNED
503,503,-636.0,2021-12-14 14:19:40.927993,2021-12-14 14:20:51.202152,0 days 00:01:10.274159,tanh,16,0.1,1.4095194243123057e-07,0.92,0.9,0.18117771070983352,5.0,1,16,small,0.19880152953201366,COMPLETE
504,504,-250000.0,2021-12-14 14:20:51.218947,2021-12-14 14:25:11.779654,0 days 00:04:20.560707,tanh,32,0.2,2.169715981065354e-05,0.95,0.95,0.2789042052514799,0.3,20,256,medium,0.964554884097329,PRUNED
505,505,-1472.0,2021-12-14 14:25:11.786234,2021-12-14 14:34:40.475395,0 days 00:09:28.689161,tanh,8,0.2,1.1748818444642261e-06,0.99,0.995,0.08545998909832592,0.3,10,32,small,0.2733248210225303,COMPLETE
506,506,-304.0,2021-12-14 14:34:40.492231,2021-12-14 14:36:17.148309,0 days 00:01:36.656078,tanh,256,0.4,1.2591957956590975e-08,0.92,0.9999,0.23709018590106093,0.7,1,32,medium,0.4772196833991517,COMPLETE
507,507,-250000.0,2021-12-14 14:36:17.165191,2021-12-14 14:55:14.178253,0 days 00:18:57.013062,tanh,64,0.1,5.133410394721134e-07,1.0,0.99,0.5231551816034757,0.3,20,8,small,0.5181632821232406,COMPLETE
508,508,-510.0,2021-12-14 14:55:14.195468,2021-12-14 14:56:12.495432,0 days 00:00:58.299964,tanh,128,0.2,3.723621820813097e-08,0.92,0.95,0.04343412949687153,0.5,1,32,small,0.10572374911354096,COMPLETE
509,509,-368.0,2021-12-14 14:56:12.515526,2021-12-14 15:02:44.131578,0 days 00:06:31.616052,tanh,512,0.3,2.257608036334554e-08,0.99,0.95,0.13946793128224902,0.3,20,512,medium,0.14158151840049765,COMPLETE
510,510,-250000.0,2021-12-14 15:02:44.148400,2021-12-14 15:04:04.954146,0 days 00:01:20.805746,tanh,32,0.2,3.065164325860696e-07,0.95,0.95,0.19206688762264182,0.3,1,256,small,0.5454810327016871,COMPLETE
511,511,-1352.0,2021-12-14 15:04:04.973299,2021-12-14 15:06:38.694163,0 days 00:02:33.720864,relu,64,0.4,2.1553358327541133e-07,0.92,0.995,0.06877221691521898,0.8,20,2048,medium,0.8858747858117733,PRUNED
512,512,-250000.0,2021-12-14 15:06:38.701262,2021-12-14 15:07:22.994301,0 days 00:00:44.293039,tanh,128,0.1,6.760862401372626e-07,0.98,0.9,0.10069655427942886,2.0,10,128,small,0.0543333978420614,PRUNED
513,513,-488.0,2021-12-14 15:07:23.000555,2021-12-14 15:10:23.004979,0 days 00:03:00.004424,tanh,8,0.2,1.0224166390576516e-07,1.0,0.9999,0.0011111289807266725,0.3,1,32,medium,0.17275177533958647,COMPLETE
514,514,-164.0,2021-12-14 15:10:23.021721,2021-12-14 15:16:21.443077,0 days 00:05:58.421356,tanh,32,0.2,4.272359707161613e-07,0.99,0.95,0.001951837076634669,0.3,20,64,small,0.23379574032378772,COMPLETE
515,515,-54.0,2021-12-14 15:16:21.460176,2021-12-14 15:22:46.237862,0 days 00:06:24.777686,tanh,512,0.4,1.0461219804767552e-06,0.8,0.95,0.050902928774469586,0.3,5,16,medium,0.3094212230666228,COMPLETE
516,516,-100.0,2021-12-14 15:22:46.253370,2021-12-14 15:28:45.856501,0 days 00:05:59.603131,tanh,256,0.2,3.0954357350043736e-08,0.92,0.98,0.0006744739362904944,0.6,20,32,small,0.9308627235472001,COMPLETE
517,517,-516.0,2021-12-14 15:28:45.873279,2021-12-14 15:29:36.182993,0 days 00:00:50.309714,tanh,64,0.1,1.3826898937813613e-08,0.95,0.995,0.43886934878136996,0.9,1,256,small,0.37560980842164193,COMPLETE
518,518,-1652.0,2021-12-14 15:29:36.200237,2021-12-14 15:43:56.011714,0 days 00:14:19.811477,tanh,128,0.3,4.388975592379385e-06,0.92,0.95,0.16314813981881948,1.0,20,32,medium,0.9499935167288185,COMPLETE
519,519,-250000.0,2021-12-14 15:43:56.028740,2021-12-14 15:45:39.791275,0 days 00:01:43.762535,tanh,16,0.2,8.088339478412745e-08,0.99,0.9999,0.3221207606541456,0.3,10,128,small,0.2151152909958584,PRUNED
520,520,-250000.0,2021-12-14 15:45:39.798113,2021-12-14 15:46:18.883333,0 days 00:00:39.085220,tanh,32,0.4,9.625218583815922e-05,0.92,0.95,0.08122562636223588,0.8,1,1024,medium,0.9997664776041695,PRUNED
521,521,-250000.0,2021-12-14 15:46:18.890281,2021-12-14 15:48:18.979814,0 days 00:02:00.089533,tanh,64,0.2,1.623306394769046e-07,1.0,0.95,0.00024154733079775808,0.3,20,32,small,0.9149414196684666,PRUNED
522,522,-882.0,2021-12-14 15:48:18.986875,2021-12-14 15:49:42.310818,0 days 00:01:23.323943,tanh,512,0.1,5.9360109121682816e-08,0.95,0.995,0.12654625496056982,0.3,1,256,medium,0.40561809950664546,COMPLETE
523,523,-744.0,2021-12-14 15:49:42.327976,2021-12-14 15:55:43.043245,0 days 00:06:00.715269,relu,128,0.2,8.02257494728744e-06,0.99,0.9,0.2522300428076535,0.3,20,32,small,0.797915299430162,COMPLETE
524,524,122.0,2021-12-14 15:55:43.060720,2021-12-14 16:06:27.429757,0 days 00:10:44.369037,tanh,8,0.2,1.7656883330905493e-06,0.92,0.95,0.009402044411732424,0.5,5,16,medium,0.2621894441166045,COMPLETE
525,525,-250000.0,2021-12-14 16:06:27.446959,2021-12-14 16:08:51.681620,0 days 00:02:24.234661,tanh,32,0.4,2.8559384594201206e-06,0.92,0.9999,0.005800093558431492,0.5,5,512,small,0.2876624063244655,COMPLETE
526,526,-1144.0,2021-12-14 16:08:51.698392,2021-12-14 16:13:10.189646,0 days 00:04:18.491254,tanh,64,0.1,3.377739438532063e-07,0.92,0.95,0.06100570898099596,0.5,5,32,medium,0.3516299035537921,COMPLETE
527,527,-250000.0,2021-12-14 16:13:10.207457,2021-12-14 16:13:41.231212,0 days 00:00:31.023755,tanh,256,0.3,5.602283745431316e-07,0.92,0.95,0.009515199754247316,0.5,5,256,small,0.8543095242153769,PRUNED
528,528,134.0,2021-12-14 16:13:41.238075,2021-12-14 16:15:42.317348,0 days 00:02:01.079273,tanh,512,0.2,1.832823956996193e-08,0.92,0.995,0.010876200771478968,0.5,5,32,small,0.9767214107268304,COMPLETE
529,529,-280.0,2021-12-14 16:15:42.334554,2021-12-14 16:17:43.147205,0 days 00:02:00.812651,tanh,512,0.2,1.875245357791763e-08,0.92,0.995,0.007330073124409125,0.5,5,32,small,0.2603114274990673,COMPLETE
530,530,-344.0,2021-12-14 16:17:43.164295,2021-12-14 16:19:47.335088,0 days 00:02:04.170793,tanh,512,0.4,1.044937297467668e-08,0.92,0.995,0.0038063680531479787,0.5,5,32,small,0.6257199117639455,COMPLETE
531,531,-520.0,2021-12-14 16:19:47.354043,2021-12-14 16:21:55.773360,0 days 00:02:08.419317,tanh,512,0.2,2.7114944418969694e-08,0.92,0.995,0.005378483329515213,0.5,5,32,small,0.9754227515343707,COMPLETE
532,532,-518.0,2021-12-14 16:21:55.791171,2021-12-14 16:23:56.990623,0 days 00:02:01.199452,tanh,512,0.1,1.8039943433549704e-08,0.92,0.995,0.010731501473807982,0.5,5,32,small,0.085084492384734,COMPLETE
533,533,-928.0,2021-12-14 16:23:57.007081,2021-12-14 16:24:32.753444,0 days 00:00:35.746363,tanh,512,0.2,1.5326198145743898e-08,0.92,0.995,0.015029667042890488,0.5,5,32,small,0.18391425773172476,PRUNED
534,534,-250000.0,2021-12-14 16:24:32.760177,2021-12-14 16:25:20.274208,0 days 00:00:47.514031,relu,512,0.2,2.9746886767761726e-08,0.9,0.995,0.011046623279599828,0.5,5,32,small,0.32344490692392175,PRUNED
