,number,value,datetime_start,datetime_complete,duration,params_activation_fn,params_batch_size,params_clip_range,params_ent_coef,params_gae_lambda,params_gamma,params_learning_rate,params_max_grad_norm,params_n_epochs,params_n_steps,params_net_arch,params_vf_coef,state
965,965,-1340.0,2021-12-15 18:51:03.987724,2021-12-15 18:51:46.262988,0 days 00:00:42.275264,tanh,128,0.1,1.010865597661825e-06,0.95,0.98,0.18318248559744688,0.3,1,128,small,0.2247256718593435,COMPLETE
966,966,-540.0,2021-12-15 18:51:46.278779,2021-12-15 18:52:31.459931,0 days 00:00:45.181152,tanh,128,0.2,7.98218598215301e-07,0.95,0.98,0.2841168565594871,0.5,1,128,small,0.9141684485911168,COMPLETE
967,967,-880.0,2021-12-15 18:52:31.475417,2021-12-15 18:53:13.449278,0 days 00:00:41.973861,tanh,128,0.1,2.1310904757006865e-06,0.95,0.98,0.13727980428535275,0.3,1,512,small,0.935729920971042,COMPLETE
968,968,-218.0,2021-12-15 18:53:13.465199,2021-12-15 18:53:54.475979,0 days 00:00:41.010780,tanh,128,0.4,1.3682270642594094e-08,0.95,0.98,0.19117393938147198,0.8,1,128,small,0.24687628576767695,COMPLETE
969,969,-142.0,2021-12-15 18:53:54.492564,2021-12-15 18:54:54.375587,0 days 00:00:59.883023,tanh,128,0.2,1.0147189096997728e-06,0.95,0.98,0.12555832926962454,0.3,1,16,small,0.4197276610963353,COMPLETE
970,970,-1718.0,2021-12-15 18:54:54.391209,2021-12-15 18:55:14.143018,0 days 00:00:19.751809,tanh,128,0.1,8.274189929798616e-08,0.95,0.98,0.15911662674693358,0.3,1,128,small,0.6186289941785956,PRUNED
971,971,-199820.0,2021-12-15 18:55:14.149107,2021-12-15 18:55:35.133082,0 days 00:00:20.983975,tanh,128,0.2,1.0788520740292823e-06,0.95,0.98,0.10313217595765914,0.5,1,128,small,0.8940966577663209,PRUNED
972,972,-828.0,2021-12-15 18:55:35.139231,2021-12-15 18:56:15.914616,0 days 00:00:40.775385,tanh,128,0.1,1.2068705672344436e-06,0.95,0.98,0.24571128817297552,0.3,1,128,small,0.9680675981259117,COMPLETE
973,973,124.0,2021-12-15 18:56:15.929982,2021-12-15 18:56:59.568216,0 days 00:00:43.638234,tanh,128,0.4,1.0042428356278086e-08,0.95,0.98,0.13332289630520774,0.3,1,128,small,0.20850563205942638,COMPLETE
974,974,-612.0,2021-12-15 18:56:59.583900,2021-12-15 18:57:41.825001,0 days 00:00:42.241101,tanh,128,0.2,3.0043468333673565e-08,0.95,0.98,0.09387165488163048,0.8,1,128,small,0.7635250929112182,COMPLETE
975,975,-416.0,2021-12-15 18:57:41.840695,2021-12-15 18:58:26.904429,0 days 00:00:45.063734,tanh,128,0.1,7.92573076178528e-07,0.95,0.98,0.11269396121465634,0.5,1,64,small,0.4432135939330489,COMPLETE
976,976,-316.0,2021-12-15 18:58:26.920157,2021-12-15 18:59:10.780665,0 days 00:00:43.860508,tanh,64,0.2,1.914605158291374e-08,0.95,0.9999,0.19545905675929742,0.3,1,128,small,0.15401959647882807,COMPLETE
977,977,-768.0,2021-12-15 18:59:10.796465,2021-12-15 19:00:30.677617,0 days 00:01:19.881152,tanh,8,0.3,5.7922519532644576e-08,0.98,0.98,0.07466841608532471,0.9,1,128,small,0.9522501438481118,COMPLETE
978,978,-680.0,2021-12-15 19:00:30.693868,2021-12-15 19:01:11.317743,0 days 00:00:40.623875,tanh,128,0.4,4.109839465631437e-08,0.8,0.9999,0.14192069253636905,0.3,1,128,small,0.3883491014881027,COMPLETE
979,979,-250000.0,2021-12-15 19:01:11.333203,2021-12-15 19:01:31.898964,0 days 00:00:20.565761,tanh,64,0.1,0.0004041239539831314,0.92,0.999,0.1658646345312883,0.3,1,128,small,0.6675963325335474,PRUNED
980,980,-250000.0,2021-12-15 19:01:31.905204,2021-12-15 19:01:53.276474,0 days 00:00:21.371270,tanh,128,0.2,1.3114972984813918e-07,0.95,0.9999,3.645234362304019e-05,0.5,1,128,small,0.9218167458333771,PRUNED
981,981,-464.0,2021-12-15 19:01:53.282524,2021-12-15 19:03:10.124714,0 days 00:01:16.842190,tanh,8,0.1,5.998093529142066e-07,0.9,0.9999,0.30943015637835997,0.3,1,64,small,0.18827230855652755,COMPLETE
982,982,-784.0,2021-12-15 19:03:10.141053,2021-12-15 19:03:54.036127,0 days 00:00:43.895074,tanh,128,0.2,1.4702966660198956e-08,0.95,0.98,0.08881883599938963,0.8,1,128,small,0.819994396136685,COMPLETE
983,983,-1136.0,2021-12-15 19:03:54.052891,2021-12-15 19:05:16.375361,0 days 00:01:22.322470,tanh,64,0.4,2.0002911642786034e-06,0.8,0.9999,0.06646142718914733,0.3,1,8,small,0.9779437919200682,COMPLETE
984,984,-1412.0,2021-12-15 19:05:16.391158,2021-12-15 19:05:59.950023,0 days 00:00:43.558865,tanh,128,0.1,0.0011837840135783412,0.95,0.999,0.037980664641158485,0.7,1,64,small,0.24984465105825943,COMPLETE
985,985,-1204.0,2021-12-15 19:05:59.965580,2021-12-15 19:06:43.533808,0 days 00:00:43.568228,tanh,64,0.2,8.093466542763356e-07,0.92,0.9999,0.10717980529238938,0.5,1,64,small,0.21893946005350223,COMPLETE
986,986,-250000.0,2021-12-15 19:06:43.549594,2021-12-15 19:07:12.207956,0 days 00:00:28.658362,tanh,8,0.1,2.413899031529247e-08,0.9,0.9999,0.22902731312964383,0.3,1,256,small,0.9999621669591038,PRUNED
987,987,-680.0,2021-12-15 19:07:12.214080,2021-12-15 19:08:02.470069,0 days 00:00:50.255989,tanh,128,0.2,4.357965884458354e-07,0.95,0.98,0.04749800211351339,0.3,1,512,small,0.9333502730142181,COMPLETE
988,988,-704.0,2021-12-15 19:08:02.485968,2021-12-15 19:08:47.311137,0 days 00:00:44.825169,tanh,64,0.4,9.962001748008955e-08,0.95,0.9999,0.0762028701435047,0.8,1,64,small,0.43123357072532664,COMPLETE
989,989,-1208.0,2021-12-15 19:08:47.326859,2021-12-15 19:09:31.579812,0 days 00:00:44.252953,tanh,128,0.2,1.3814861614483654e-06,0.8,0.9999,0.12593144913858761,5.0,1,2048,small,0.695826551515586,COMPLETE
990,990,-250000.0,2021-12-15 19:09:31.595489,2021-12-15 19:10:03.729865,0 days 00:00:32.134376,tanh,8,0.1,1.334160139044358e-08,0.92,0.999,0.1709140558570017,0.3,1,64,small,0.638770283200427,PRUNED
991,991,-630.0,2021-12-15 19:10:03.736017,2021-12-15 19:11:03.542158,0 days 00:00:59.806141,tanh,64,0.4,6.726042608005951e-08,0.9,0.9999,0.05963529610976405,0.5,1,16,small,0.1183628950542691,COMPLETE
992,992,-1150.0,2021-12-15 19:11:03.557751,2021-12-15 19:11:23.199138,0 days 00:00:19.641387,tanh,128,0.2,8.992289881712558e-07,0.95,0.98,0.0908974832875998,0.3,1,256,small,0.344790031338911,PRUNED
993,993,-250000.0,2021-12-15 19:11:23.205457,2021-12-15 19:11:43.399716,0 days 00:00:20.194259,tanh,128,0.1,3.3846398575958454e-08,0.95,0.9999,0.1151576463864046,0.3,1,1024,small,0.5220750084791318,PRUNED
994,994,288.0,2021-12-15 19:11:43.405948,2021-12-15 19:12:27.282235,0 days 00:00:43.876287,tanh,64,0.3,6.254719385040487e-07,1.0,0.9999,0.20946157011845457,0.9,1,64,small,0.23659305423877017,COMPLETE
995,995,-1150.0,2021-12-15 19:12:27.297999,2021-12-15 19:13:10.791890,0 days 00:00:43.493891,tanh,64,0.3,5.584798214253385e-07,0.92,0.9999,0.37643145131420874,0.9,1,64,small,0.2111815010338432,COMPLETE
996,996,-1496.0,2021-12-15 19:13:10.807396,2021-12-15 19:13:54.279396,0 days 00:00:43.472000,tanh,64,0.3,6.568345008413019e-07,0.8,0.999,0.2879713407287888,0.9,1,64,small,0.24311613221051206,COMPLETE
997,997,-338.0,2021-12-15 19:13:54.295152,2021-12-15 19:14:38.325589,0 days 00:00:44.030437,tanh,64,0.3,3.711056580279039e-07,0.9,0.98,0.22138748009223613,0.9,1,64,small,0.1919597345803576,COMPLETE
998,998,-1306.0,2021-12-15 19:14:38.341791,2021-12-15 19:15:21.934910,0 days 00:00:43.593119,tanh,64,0.3,5.1103503191099e-07,0.95,0.9999,0.2390159810955841,0.9,1,64,small,0.22937052532753005,COMPLETE
999,999,-1300.0,2021-12-15 19:15:21.950809,2021-12-15 19:16:05.398133,0 days 00:00:43.447324,tanh,64,0.3,8.233444576601999e-07,1.0,0.9999,0.337646916848215,0.9,1,64,small,0.20706968962599934,COMPLETE
