,number,value,datetime_start,datetime_complete,duration,params_activation_fn,params_batch_size,params_clip_range,params_ent_coef,params_gae_lambda,params_gamma,params_learning_rate,params_max_grad_norm,params_n_epochs,params_n_steps,params_net_arch,params_vf_coef,state
0,0,-250000.0,2021-12-15 23:59:18.204013,2021-12-16 00:00:34.649099,0 days 00:01:16.445086,tanh,512,0.3,0.00018830397154125244,0.8,0.98,0.0010093535153723608,1.0,1,2048,small,0.4859235274664301,COMPLETE
1,1,-296.0,2021-12-16 00:00:34.666998,2021-12-16 00:03:03.878750,0 days 00:02:29.211752,relu,32,0.2,9.091272989606487e-06,0.95,0.9,0.0022055964507550966,0.7,1,8,medium,0.19803488296939276,COMPLETE
2,2,-1344.0,2021-12-16 00:03:03.891965,2021-12-16 00:23:29.485443,0 days 00:20:25.593478,tanh,16,0.2,0.004243273807911173,0.95,0.9999,0.00023371062377755105,0.8,20,1024,medium,0.06756077724070353,COMPLETE
3,3,-942.0,2021-12-16 00:23:29.498901,2021-12-16 00:25:33.198090,0 days 00:02:03.699189,relu,64,0.4,6.1808029374013896e-06,0.95,0.9999,0.0058601965688220466,0.3,10,512,small,0.06337285976510665,COMPLETE
4,4,-250000.0,2021-12-16 00:25:33.211397,2021-12-16 00:28:34.663347,0 days 00:03:01.451950,relu,8,0.4,1.994606793570207e-06,0.99,0.9999,0.0008581010801444581,0.8,1,16,medium,0.3884026080268729,COMPLETE
5,5,-1000.0,2021-12-16 00:28:34.676580,2021-12-16 00:45:46.491959,0 days 00:17:11.815379,tanh,8,0.4,0.06475996540969979,0.98,0.98,0.031935019645421364,2.0,10,256,medium,0.012833827938311337,COMPLETE
6,6,-249794.0,2021-12-16 00:45:46.505397,2021-12-16 00:49:07.273152,0 days 00:03:20.767755,tanh,32,0.2,0.0002002715205749489,0.98,0.95,2.2022376826572794e-05,0.6,10,512,small,0.2783765880662499,COMPLETE
7,7,-484.0,2021-12-16 00:49:07.286248,2021-12-16 00:53:07.956938,0 days 00:04:00.670690,tanh,512,0.1,3.725915416576882e-05,0.9,0.995,0.25491081475546057,0.6,10,128,medium,0.8851059542776041,COMPLETE
8,8,-200288.0,2021-12-16 00:53:07.971856,2021-12-16 01:00:12.492138,0 days 00:07:04.520282,tanh,512,0.3,2.424812052695426e-07,0.98,0.999,2.2349714820276578e-05,0.6,20,2048,medium,0.6672642241247859,COMPLETE
9,9,-1232.0,2021-12-16 01:00:12.505492,2021-12-16 01:33:23.106083,0 days 00:33:10.600591,tanh,64,0.2,5.3104457857730664e-05,0.95,0.995,0.015630371399156476,0.8,20,8,medium,0.45383583308857933,COMPLETE
10,10,-556.0,2021-12-16 01:33:23.120132,2021-12-16 01:37:30.671993,0 days 00:04:07.551861,relu,32,0.1,1.06437953529245e-08,0.92,0.9,0.7231252932987735,0.7,5,8,small,0.2423097159909141,COMPLETE
11,11,254.0,2021-12-16 01:37:30.685234,2021-12-16 01:38:36.452196,0 days 00:01:05.766962,relu,128,0.1,6.872550603720529e-07,0.9,0.9,0.2433513935138755,5.0,1,128,medium,0.9949823029315671,COMPLETE
12,12,-1196.0,2021-12-16 01:38:36.465547,2021-12-16 01:39:43.912199,0 days 00:01:07.446652,relu,128,0.1,2.321348902697831e-07,1.0,0.9,0.08614762369257935,5.0,1,128,medium,0.9483985422477097,COMPLETE
13,13,-250000.0,2021-12-16 01:39:43.925658,2021-12-16 01:40:15.001970,0 days 00:00:31.076312,relu,256,0.1,7.026035472755686e-07,0.9,0.99,0.0001840053864935879,5.0,1,64,medium,0.7434851302724614,PRUNED
14,14,-245258.0,2021-12-16 01:40:15.006226,2021-12-16 01:40:49.215890,0 days 00:00:34.209664,relu,128,0.2,3.087185118902774e-08,0.9,0.9,0.002874399563632283,0.5,1,32,medium,0.6195671856756253,PRUNED
15,15,-1416.0,2021-12-16 01:40:49.220319,2021-12-16 01:42:00.744994,0 days 00:01:11.524675,relu,32,0.1,6.138867711759784e-06,0.99,0.9,0.08019972060212052,0.9,5,128,medium,0.2237391684942675,PRUNED
16,16,-410.0,2021-12-16 01:42:00.749706,2021-12-16 01:44:28.795417,0 days 00:02:28.045711,relu,128,0.2,0.0007124258968921709,0.8,0.9,0.9084577534643733,0.7,1,8,medium,0.8418607879167677,COMPLETE
17,17,-250000.0,2021-12-16 01:44:28.808613,2021-12-16 01:44:57.368049,0 days 00:00:28.559436,relu,256,0.3,6.976569824581646e-08,1.0,0.95,0.008217322609314601,0.7,1,256,medium,0.9976053164272766,PRUNED
18,18,-100826.0,2021-12-16 01:44:57.372374,2021-12-16 01:45:18.921374,0 days 00:00:21.549000,relu,16,0.2,3.817614145245668e-06,0.92,0.99,0.00014067934378058367,5.0,1,1024,small,0.6003073724527218,PRUNED
19,19,-98110.0,2021-12-16 01:45:18.925861,2021-12-16 01:47:02.903610,0 days 00:01:43.977749,relu,128,0.1,9.930135958346349e-07,0.95,0.999,0.0016813684685623655,1.0,5,16,medium,0.3238353818801525,PRUNED
20,20,-660.0,2021-12-16 01:47:02.908170,2021-12-16 01:48:25.067397,0 days 00:01:22.159227,relu,32,0.2,1.9041507725426016e-05,0.9,0.9,0.044525642906150874,2.0,1,32,medium,0.1729041335179522,COMPLETE
21,21,-1066.0,2021-12-16 01:48:25.080628,2021-12-16 01:50:52.718047,0 days 00:02:27.637419,relu,128,0.2,0.0016203244057579175,0.8,0.9,0.9733725772628674,0.7,1,8,medium,0.8401252846598923,COMPLETE
22,22,-360.0,2021-12-16 01:50:52.731371,2021-12-16 01:53:20.330068,0 days 00:02:27.598697,relu,128,0.2,0.0016596811710832945,0.8,0.9,0.26591590854414515,0.7,1,8,medium,0.7787213835618986,COMPLETE
23,23,124.0,2021-12-16 01:53:20.344244,2021-12-16 01:55:49.282420,0 days 00:02:28.938176,relu,128,0.2,0.006073421460992411,0.8,0.9,0.23259904142933205,0.7,1,8,medium,0.7383439829117554,COMPLETE
24,24,-1388.0,2021-12-16 01:55:49.295763,2021-12-16 01:57:00.672595,0 days 00:01:11.376832,relu,128,0.2,0.018384593430774792,0.95,0.9,0.1801848291844769,0.5,1,64,medium,0.5543484305619995,COMPLETE
25,25,-148088.0,2021-12-16 01:57:00.685771,2021-12-16 01:57:27.851108,0 days 00:00:27.165337,relu,32,0.1,1.5846690551056465e-05,0.9,0.9,0.013852788360462035,0.9,1,128,medium,0.7207892308509842,PRUNED
26,26,-50264.0,2021-12-16 01:57:27.855489,2021-12-16 01:58:03.557369,0 days 00:00:35.701880,relu,128,0.4,0.00016880877915781726,0.8,0.9,0.00049227644602651,0.3,1,8,small,0.9330129915321428,PRUNED
27,27,-976.0,2021-12-16 01:58:03.561814,2021-12-16 02:06:53.596131,0 days 00:08:50.034317,relu,64,0.3,0.012909039067945246,0.99,0.95,0.02464660756243101,5.0,5,8,medium,0.4064819158745193,COMPLETE
28,28,-52.0,2021-12-16 02:06:53.609328,2021-12-16 02:26:02.249957,0 days 00:19:08.640629,relu,16,0.2,4.51517983139423e-07,0.92,0.98,0.09272503902961178,0.7,20,128,medium,0.8088449753576787,COMPLETE
29,29,-968.0,2021-12-16 02:26:02.263862,2021-12-16 02:34:13.225579,0 days 00:08:10.961717,relu,16,0.3,2.8607047659819897e-07,0.92,0.98,0.1024042891254149,1.0,20,128,small,0.8024993339029343,COMPLETE
30,30,-98876.0,2021-12-16 02:34:13.238679,2021-12-16 02:39:03.814300,0 days 00:04:50.575621,relu,16,0.1,1.1131258451784679e-07,0.92,0.98,0.3558422389018676,0.7,20,2048,medium,0.9992529835082805,PRUNED
31,31,-392.0,2021-12-16 02:39:03.818841,2021-12-16 02:58:13.032059,0 days 00:19:09.213218,relu,16,0.2,1.342392599583867e-06,0.8,0.98,0.005171560190057666,0.7,20,128,medium,0.6902314690622202,COMPLETE
32,32,-632.0,2021-12-16 02:58:13.045383,2021-12-16 03:17:22.375154,0 days 00:19:09.329771,relu,16,0.2,4.0608239060376724e-07,0.92,0.98,0.05135367010223167,0.7,20,128,medium,0.9038026949165503,COMPLETE
33,33,-150232.0,2021-12-16 03:17:22.388358,2021-12-16 03:17:45.692961,0 days 00:00:23.304603,relu,256,0.2,2.6518503460093543e-06,0.95,0.995,0.46039501431236274,0.7,1,512,medium,0.5460962230966735,PRUNED
34,34,-242.0,2021-12-16 03:17:45.697486,2021-12-16 03:52:03.179546,0 days 00:34:17.482060,relu,8,0.2,0.0001243708939297141,1.0,0.9999,0.15688603749842175,0.3,20,1024,medium,0.15661874238165513,COMPLETE
35,35,-744.0,2021-12-16 03:52:03.192755,2021-12-16 04:26:37.092067,0 days 00:34:33.899312,relu,8,0.2,0.0001592690446781173,1.0,0.9999,0.14937485064519596,0.3,20,1024,medium,0.8346850560292667,COMPLETE
36,36,296.0,2021-12-16 04:26:37.106280,2021-12-16 05:00:54.321267,0 days 00:34:17.214987,tanh,8,0.4,0.039353031577952634,1.0,0.9999,0.4310204365380465,0.3,20,1024,medium,0.4839689730878012,COMPLETE
37,37,-250000.0,2021-12-16 05:00:54.334357,2021-12-16 05:04:38.437268,0 days 00:03:44.102911,tanh,8,0.4,0.09247436998584506,1.0,0.9999,0.47953753694412726,0.3,20,1024,small,0.4838168335494884,PRUNED
38,38,-250000.0,2021-12-16 05:04:38.442097,2021-12-16 05:09:42.367984,0 days 00:05:03.925887,tanh,8,0.4,0.0271714556785694,0.9,0.9999,0.05859207976050555,2.0,10,256,medium,0.6068810844412157,PRUNED
39,39,-250000.0,2021-12-16 05:09:42.372587,2021-12-16 05:19:41.363498,0 days 00:09:58.990911,tanh,8,0.4,0.006853739095620259,0.98,0.999,0.4150262132424932,5.0,20,16,medium,0.6588093195614119,PRUNED
40,40,-250000.0,2021-12-16 05:19:41.367979,2021-12-16 05:21:20.338498,0 days 00:01:38.970519,tanh,512,0.4,0.0004988349102455273,1.0,0.98,0.026609778754808185,0.8,20,1024,medium,0.7650498383456983,PRUNED
41,41,-250000.0,2021-12-16 05:21:20.343030,2021-12-16 05:29:33.711932,0 days 00:08:13.368902,tanh,8,0.4,0.03973034879823147,1.0,0.9999,0.14942809955573008,0.3,20,1024,medium,0.1351240296633111,PRUNED
42,42,-250000.0,2021-12-16 05:29:33.716874,2021-12-16 05:37:47.984796,0 days 00:08:14.267922,tanh,8,0.2,0.006782727071425652,1.0,0.9999,0.20457116435661477,0.3,20,1024,medium,0.30991129014936686,PRUNED
43,43,-1024.0,2021-12-16 05:37:47.989205,2021-12-16 06:12:05.855653,0 days 00:34:17.866448,tanh,8,0.2,0.003580513498440187,1.0,0.9999,0.1360420240184855,0.3,20,1024,medium,0.06637729274670284,COMPLETE
44,44,-16.0,2021-12-16 06:12:05.869853,2021-12-16 06:17:22.541756,0 days 00:05:16.671903,relu,64,0.4,6.647783912217445e-05,0.92,0.9999,0.53964598355351,0.3,10,2048,medium,0.39341748333213444,COMPLETE
45,45,-250000.0,2021-12-16 06:17:22.555697,2021-12-16 06:18:45.291033,0 days 00:01:22.735336,relu,64,0.4,7.878312721191358e-05,0.92,0.99,0.6195781985717866,0.5,10,2048,medium,0.3687031817304874,PRUNED
46,46,-560.0,2021-12-16 06:18:45.295497,2021-12-16 06:21:00.971900,0 days 00:02:15.676403,tanh,64,0.4,2.563223489508415e-08,0.92,0.995,0.6153650602452918,0.6,10,2048,small,0.5231169387357104,COMPLETE
47,47,-250000.0,2021-12-16 06:21:00.986370,2021-12-16 06:22:20.236862,0 days 00:01:19.250492,relu,64,0.4,0.052507039093990564,0.92,0.9999,0.3252300027399545,0.9,10,2048,medium,0.43285727911277366,PRUNED
48,48,-784.0,2021-12-16 06:22:20.241386,2021-12-16 06:26:16.630065,0 days 00:03:56.388679,relu,512,0.1,0.0003878152247938999,0.99,0.98,0.08091342184876094,5.0,10,128,medium,0.4739777457604436,COMPLETE
49,49,-250000.0,2021-12-16 06:26:16.644005,2021-12-16 06:27:52.900111,0 days 00:01:36.256106,tanh,128,0.4,9.614981215267796e-06,0.98,0.999,6.07458396200723e-05,0.8,10,64,medium,0.35918606910838385,PRUNED
50,50,8.0,2021-12-16 06:27:52.904949,2021-12-16 06:30:43.201735,0 days 00:02:50.296786,relu,64,0.3,0.0014368151536857934,0.9,0.95,0.25989764517559777,1.0,5,512,medium,0.9137480865478977,COMPLETE
51,51,-882.0,2021-12-16 06:30:43.215040,2021-12-16 06:33:32.100882,0 days 00:02:48.885842,relu,64,0.3,0.0038021420288870144,0.9,0.95,0.26548639901827414,1.0,5,512,medium,0.9602875359640174,COMPLETE
52,52,-250000.0,2021-12-16 06:33:32.114709,2021-12-16 06:34:31.659406,0 days 00:00:59.544697,relu,64,0.3,0.0012600781350581931,0.9,0.95,0.9245764490715933,1.0,5,128,medium,0.8674033197667514,PRUNED
53,53,-654.0,2021-12-16 06:34:31.663976,2021-12-16 06:37:22.756322,0 days 00:02:51.092346,relu,64,0.3,0.00823181503439934,0.9,0.95,0.2511237689626998,1.0,5,512,medium,0.9023582451398783,COMPLETE
54,54,-250000.0,2021-12-16 06:37:22.769558,2021-12-16 06:38:12.546236,0 days 00:00:49.776678,relu,128,0.3,3.385770668760505e-05,0.8,0.95,0.10971811452364592,0.3,5,512,medium,0.9467320680077188,PRUNED
55,55,-796.0,2021-12-16 06:38:12.550920,2021-12-16 06:43:34.662461,0 days 00:05:22.111541,relu,16,0.4,1.1472548407570787e-07,0.92,0.99,0.63158749705606,0.6,5,32,medium,0.822302749364786,COMPLETE
56,56,-882.0,2021-12-16 06:43:34.675905,2021-12-16 06:44:55.871394,0 days 00:01:21.195489,relu,64,0.1,0.0021696295207064976,0.9,0.9,0.39535811961421524,2.0,1,2048,medium,0.8844890523811025,COMPLETE
57,57,-728.0,2021-12-16 06:44:55.884752,2021-12-16 06:45:29.193673,0 days 00:00:33.308921,relu,256,0.1,0.012617505530445211,0.9,0.9999,0.0663672678812266,5.0,10,256,small,0.9700333329053537,PRUNED
58,58,-1072.0,2021-12-16 06:45:29.198300,2021-12-16 06:47:14.284387,0 days 00:01:45.086087,relu,128,0.3,7.180807068201565e-07,0.8,0.9,0.037022222946918655,0.7,1,16,medium,0.731032493114536,COMPLETE
59,59,-250000.0,2021-12-16 06:47:14.297656,2021-12-16 06:48:41.079128,0 days 00:01:26.781472,relu,128,0.4,0.00032553752877055353,0.92,0.995,0.25388807504026684,1.0,1,512,medium,0.4217112451096169,COMPLETE
60,60,-250000.0,2021-12-16 06:48:41.092846,2021-12-16 06:49:40.688103,0 days 00:00:59.595257,tanh,64,0.1,0.0007310147269090351,0.99,0.95,0.6365529471363739,0.5,5,128,medium,0.7905636093883467,PRUNED
61,61,-250000.0,2021-12-16 06:49:40.692524,2021-12-16 07:24:10.874274,0 days 00:34:30.181750,relu,8,0.2,8.330612957275696e-05,1.0,0.9999,0.180771834425233,0.3,20,1024,medium,0.10425137567272375,COMPLETE
62,62,-250000.0,2021-12-16 07:24:10.889030,2021-12-16 07:34:09.475429,0 days 00:09:58.586399,relu,8,0.2,7.174198746631694e-06,1.0,0.9999,0.10612231538851966,0.3,20,8,medium,5.447024753024721e-06,PRUNED
63,63,-792.0,2021-12-16 07:34:09.479898,2021-12-16 07:53:17.252544,0 days 00:19:07.772646,relu,16,0.2,1.561404397511008e-05,0.9,0.9999,0.017704331595655504,0.3,20,32,medium,0.2540828177599297,COMPLETE
64,64,-230.0,2021-12-16 07:53:17.265898,2021-12-16 08:05:29.814692,0 days 00:12:12.548794,relu,32,0.2,5.341321591036279e-05,0.8,0.9,0.2081884604723955,0.3,20,64,medium,0.573022418349388,COMPLETE
65,65,-1128.0,2021-12-16 08:05:29.828139,2021-12-16 08:06:51.162638,0 days 00:01:21.334499,relu,32,0.2,0.026535937293185454,0.8,0.9,0.3039303822293334,0.7,1,64,medium,0.685824628549332,COMPLETE
66,66,-156.0,2021-12-16 08:06:51.175966,2021-12-16 08:19:04.449851,0 days 00:12:13.273885,relu,32,0.3,1.528405497392344e-06,0.8,0.9,0.5066625563633127,0.9,20,64,medium,0.5582833682374307,COMPLETE
67,67,-654.0,2021-12-16 08:19:04.463476,2021-12-16 08:20:26.127374,0 days 00:01:21.663898,relu,32,0.3,2.446587722697529e-06,0.8,0.9,0.5023859355087481,0.9,1,64,medium,0.456273389738163,COMPLETE
68,68,-250000.0,2021-12-16 08:20:26.142011,2021-12-16 08:21:24.975688,0 days 00:00:58.833677,relu,32,0.3,1.7131522380227905e-07,0.8,0.9,0.8301010904134295,5.0,10,128,small,0.9203897918451396,PRUNED
69,69,-944.0,2021-12-16 08:21:24.980155,2021-12-16 08:54:28.727605,0 days 00:33:03.747450,relu,128,0.3,1.5080588174623945e-06,0.92,0.98,0.0014518729105415479,0.9,20,8,medium,0.87982805053328,COMPLETE
70,70,-250000.0,2021-12-16 08:54:28.741158,2021-12-16 08:55:30.645016,0 days 00:01:01.903858,relu,512,0.3,4.0006841470760484e-07,0.95,0.9,1.2456004322404865e-05,0.9,5,64,medium,0.5170688488437906,PRUNED
71,71,326.0,2021-12-16 08:55:30.649545,2021-12-16 09:07:52.395980,0 days 00:12:21.746435,relu,32,0.2,4.10315394255726e-06,0.8,0.9,0.2004020133323789,0.7,20,64,medium,0.5619918548393977,COMPLETE
72,72,-824.0,2021-12-16 09:07:52.409417,2021-12-16 09:20:06.234496,0 days 00:12:13.825079,relu,32,0.1,7.805863126421284e-07,0.8,0.9,0.41634827654455286,0.7,20,64,medium,0.6406344762398055,COMPLETE
73,73,-756.0,2021-12-16 09:20:06.247787,2021-12-16 09:32:33.565939,0 days 00:12:27.318152,relu,32,0.3,4.848977595537912e-06,0.8,0.9,0.1173468869272224,0.7,20,64,medium,0.5542663206672385,COMPLETE
74,74,-750.0,2021-12-16 09:32:33.579366,2021-12-16 09:44:48.440241,0 days 00:12:14.860875,relu,32,0.2,4.7027890871876443e-07,0.8,0.9,0.33064000441003744,0.7,20,128,medium,0.7535275483186694,COMPLETE
75,75,-736.0,2021-12-16 09:44:48.453651,2021-12-16 10:06:04.259653,0 days 00:21:15.806002,relu,16,0.4,4.586387393822324e-08,0.98,0.999,0.22803219285632362,0.7,20,2048,medium,0.5896081234108297,COMPLETE
76,76,-250000.0,2021-12-16 10:06:04.273274,2021-12-16 10:06:35.985325,0 days 00:00:31.712051,tanh,256,0.2,3.670054628235683e-06,0.92,0.9,0.5226060730031371,0.9,1,512,medium,0.9827917174890268,PRUNED
77,77,-396.0,2021-12-16 10:06:35.989807,2021-12-16 10:39:51.604207,0 days 00:33:15.614400,relu,128,0.3,1.0605521971874261e-06,0.9,0.98,0.7987785750704482,0.8,20,8,medium,0.5067710717725465,COMPLETE
78,78,-814.0,2021-12-16 10:39:51.617591,2021-12-16 10:48:42.308660,0 days 00:08:50.691069,relu,64,0.4,1.9900894041690474e-06,0.8,0.99,0.0785756655718106,0.7,20,64,medium,0.3861964623888118,COMPLETE
79,79,-1172.0,2021-12-16 10:48:42.322690,2021-12-16 10:49:33.313393,0 days 00:00:50.990703,relu,32,0.2,1.0816924978907434e-05,0.92,0.9,0.17094645749831144,1.0,1,256,small,0.7014706067973394,COMPLETE
80,80,-250000.0,2021-12-16 10:49:33.326723,2021-12-16 11:00:03.271810,0 days 00:10:29.945087,tanh,16,0.1,0.08999413685170686,0.8,0.95,0.04849354939288978,2.0,10,128,medium,0.857768135238296,COMPLETE
81,81,-792.0,2021-12-16 11:00:03.285390,2021-12-16 11:12:14.732314,0 days 00:12:11.446924,relu,32,0.2,5.471956193007092e-05,0.8,0.9,0.19794578283273465,0.3,20,64,medium,0.5815273238814795,COMPLETE
82,82,-464.0,2021-12-16 11:12:14.745831,2021-12-16 11:24:25.136295,0 days 00:12:10.390464,relu,32,0.2,2.8433694966167405e-05,0.8,0.9,0.34126189445765903,0.3,20,64,medium,0.624789571175536,COMPLETE
83,83,-868.0,2021-12-16 11:24:25.149807,2021-12-16 11:36:35.998508,0 days 00:12:10.848701,relu,32,0.2,2.6014325664770397e-07,0.8,0.9,0.23045005443774508,5.0,20,64,medium,0.5714481387651845,COMPLETE
84,84,-840.0,2021-12-16 11:36:36.012750,2021-12-16 11:55:37.907132,0 days 00:19:01.894382,relu,32,0.2,0.0002290277871461804,0.8,0.9,0.13255418313733822,0.6,20,16,medium,0.5348659106740477,COMPLETE
85,85,-250000.0,2021-12-16 11:55:37.920715,2021-12-16 11:58:26.088159,0 days 00:02:48.167444,relu,128,0.2,3.4387439725700964e-06,0.9,0.995,0.004862124547761358,0.3,20,64,medium,0.489720383840438,PRUNED
86,86,-250000.0,2021-12-16 11:58:26.092655,2021-12-16 12:08:23.875456,0 days 00:09:57.782801,relu,64,0.4,0.002371415750895834,0.99,0.98,0.988488409716898,0.7,20,8,medium,0.4503505696586863,PRUNED
87,87,-250000.0,2021-12-16 12:08:23.879987,2021-12-16 12:09:06.968571,0 days 00:00:43.088584,relu,512,0.2,0.0009994556829350507,0.95,0.9,0.4597123451431158,0.5,5,2048,medium,0.3131814943288518,PRUNED
88,88,-250000.0,2021-12-16 12:09:06.973160,2021-12-16 12:10:55.923942,0 days 00:01:48.950782,tanh,32,0.3,1.6278239910623984e-06,0.92,0.9999,0.09966224995108058,1.0,1,512,medium,0.3501806116751271,COMPLETE
89,89,80.0,2021-12-16 12:10:55.937318,2021-12-16 12:14:52.181638,0 days 00:03:56.244320,relu,128,0.1,2.4360700775511588e-05,0.98,0.999,0.3161062577660052,0.3,10,128,medium,0.6545003640596907,COMPLETE
90,90,-512.0,2021-12-16 12:14:52.194623,2021-12-16 12:18:49.512317,0 days 00:03:57.317694,relu,128,0.1,5.406058977935276e-07,0.98,0.999,0.6524293141583507,0.9,10,128,medium,0.7107771602045003,COMPLETE
91,91,-250000.0,2021-12-16 12:18:49.525884,2021-12-16 12:20:09.684718,0 days 00:01:20.158834,relu,128,0.1,2.3825576599212058e-05,0.98,0.999,0.2863344765439423,0.3,10,128,medium,0.6558152476831317,PRUNED
92,92,-250000.0,2021-12-16 12:20:09.689325,2021-12-16 12:21:29.787310,0 days 00:01:20.097985,relu,128,0.1,1.7336696009886154e-05,0.98,0.999,0.18694213002936894,0.3,10,128,medium,0.6286817685104673,PRUNED
93,93,-250000.0,2021-12-16 12:21:29.791922,2021-12-16 12:22:50.090480,0 days 00:01:20.298558,relu,128,0.1,4.247635117354567e-05,0.98,0.999,0.0006381162389257228,0.3,10,128,medium,0.5726096121426741,PRUNED
94,94,-690.0,2021-12-16 12:22:50.095112,2021-12-16 12:29:17.624983,0 days 00:06:27.529871,relu,64,0.4,9.699737817772193e-05,0.9,0.95,0.3579836919104996,0.3,10,32,medium,0.8125642980323096,COMPLETE
95,95,140.0,2021-12-16 12:29:17.638360,2021-12-16 12:48:26.135044,0 days 00:19:08.496684,relu,16,0.1,1.0745203228487408e-06,0.8,0.9,0.14685627329057577,5.0,20,64,medium,0.6720785524062929,COMPLETE
96,96,-250000.0,2021-12-16 12:48:26.149750,2021-12-16 12:49:03.376875,0 days 00:00:37.227125,relu,16,0.1,1.102953772022805e-06,0.92,0.98,0.5391186022787948,5.0,1,1024,medium,0.6740309829490368,PRUNED
97,97,344.0,2021-12-16 12:49:03.381403,2021-12-16 12:52:02.314386,0 days 00:02:58.932983,relu,16,0.1,5.711532430500101e-06,1.0,0.9999,0.0660648104755406,5.0,5,2048,small,0.7643073222975222,COMPLETE
98,98,-250000.0,2021-12-16 12:52:02.327895,2021-12-16 12:52:50.509989,0 days 00:00:48.182094,tanh,16,0.1,4.704227686113695e-06,1.0,0.9999,0.06210534650262609,5.0,5,2048,small,0.77199181981443,PRUNED
99,99,-250000.0,2021-12-16 12:52:50.514604,2021-12-16 12:53:36.683633,0 days 00:00:46.169029,relu,16,0.1,1.2459147445448353e-05,1.0,0.9999,0.03827326564453523,5.0,5,2048,small,0.7507592924034163,PRUNED
100,100,-250000.0,2021-12-16 12:53:36.688316,2021-12-16 12:54:24.109387,0 days 00:00:47.421071,relu,16,0.1,7.107766338048514e-06,1.0,0.9999,0.13804280543740058,5.0,5,2048,small,0.7244699399315147,PRUNED
101,101,-250000.0,2021-12-16 12:54:24.114225,2021-12-16 12:55:12.025984,0 days 00:00:47.911759,relu,16,0.1,1.4766622722397015e-07,1.0,0.9999,0.0894778587804323,5.0,5,2048,small,0.6010067497143139,PRUNED
102,102,-1152.0,2021-12-16 12:55:12.030588,2021-12-16 13:04:03.038662,0 days 00:08:51.008074,relu,16,0.1,2.004759507581493e-06,0.9,0.9,0.27990291893402724,5.0,20,128,small,0.9294830758381964,COMPLETE
103,103,-888.0,2021-12-16 13:04:03.052404,2021-12-16 13:09:31.347753,0 days 00:05:28.295349,relu,16,0.1,8.165736424003187e-07,0.8,0.99,0.01089954019301214,0.7,5,512,medium,0.7869192164835661,COMPLETE
104,104,-1090.0,2021-12-16 13:09:31.361223,2021-12-16 13:14:25.332474,0 days 00:04:53.971251,relu,256,0.1,0.0047697723755574335,1.0,0.9999,0.1588691375475861,5.0,10,64,medium,0.6562463248849424,COMPLETE
105,105,-976.0,2021-12-16 13:14:25.346123,2021-12-16 13:16:30.723179,0 days 00:02:05.377056,relu,128,0.4,3.2744079761244257e-07,0.8,0.95,0.42172248168933146,1.0,20,256,medium,0.8450487401162835,PRUNED
106,106,-660.0,2021-12-16 13:16:30.727880,2021-12-16 13:17:53.242402,0 days 00:01:22.514522,relu,64,0.3,0.017527561275368832,0.92,0.9,0.7398066067636445,0.7,1,8,small,0.687367072184078,COMPLETE
